3/14/2020,Finland,Faktabaari/FactBar,A list of comments Finnish national health authorities has made publicly between 20th of January and 3rd of March. We got a request to fact check that list.,original unknown,https://www.facebook.com/photo.php?fbid=10158437425354260&set=gm.1806518436146461&type=3&theater&ifg=1,https://faktabaari.fi/somessa-leviv-thl-ja-koronavirus-uutisissa-kooste-on-harhaanjohtava-ja-vahingoittavaa-tietoa/,Misleading,"Currently, an image with the title ""THL and coronavirus in the news"" is being circulated in social media, gathering comments from the National Institute for Health and Welfare on coronavirus from January to March. The statements quoted by THL experts are quoted but appear to be largely inaccurate when removed from context. The list as a whole is deliberately misleading. Its purpose is to undermine the credibility of the responsible authority, THL, without providing it with verified information. "
1/31/2020,Croatia,Faktograf,Coronavirus is enabled by 5G technology,Facebook users,https://www.facebook.com/Svjesnost/posts/3693138000703834,https://faktograf.hr/2020/01/31/nema-nikakvih-dokaza-da-je-koronavirus-povezan-s-5g-tehnologijom/,False ,There is no scientific proof that coronavirus is in any way linked to 5G.
2/5/2020,Croatia,Faktograf,Coronavirus is caused by bat-soup,Website,dizajndoma.info/objavili-video-zene-koja-jede-sismise-uzrok-korona-virusa-vrlo-jasno-se-vidi-na-snimku/,https://faktograf.hr/2020/02/05/nije-dokazano-da-je-jedenje-juhe-od-sismisa-povezano-s-koronavirusom/,False ,There is no evidence that eating bat-soup is the cause of coronavirus.
2/6/2020,Croatia,Faktograf,Coronavirus was created in laboratory in Wuhan,Website,https://www.hop.com.hr/2020/02/03/u-laboratoriju-u-wuhanu-stvoren-corona-virus-koji-je-greskom-izasao-iz-laboratorija/,https://faktograf.hr/2020/02/06/nema-dokaza-da-je-koronavirus-kreiran-u-laboratoriju-u-wuhanu/,False ,There is no evidence that coronavirus was created in a laboratory in Wuhan.
1/27/2020,Croatia,Faktograf,BIll Gates contributed to the spread of coronavirus.,"FB post
",https://www.facebook.com/MatrixWorldhr/posts/2902224963162032,https://faktograf.hr/?p=15933,Misleading,The work that Bill & Melinda Gates Foundation does on healthcare has in no way contributed to the spread of coronavirus.
3/5/2020,Croatia,Faktograf,Medical book states that coronavirus is just a common cold,FB,https://archive.li/7kCfa,https://faktograf.hr/2020/03/12/ne-vjerujte-viralnoj-fotografiji-koronavirus-nije-obicna-prehlada/,False ,COVID-19 is more dangerous than the common cold
3/11/2020,Croatia,Faktograf,"holding your breath for 10sec can determine if you have COVID-19, drink water every 15 minutes",FB,http://archive.li/oknZL,https://faktograf.hr/2020/03/12/zadrzavanje-daha-na-10-sekundi-topla-voda-sladoled-i-ostale-dezinformacije-vezane-za-koronavirus/,False ,The article lists myths that go against WHO recommendations
3/12/2020,Croatia,Faktograf,drinking water in which garlic was boiled will cure you from COVID-19,FB,http://archive.li/ms7Xn,https://faktograf.hr/2020/03/13/prokuhani-cesnjak-nece-vas-izlijeciti-od-covid-19/,False ,There is no evidence to support this claim
3/13/2020,Croatia,Faktograf,image showing italian doctors,FB,in article,https://faktograf.hr/2020/03/13/ovo-nije-fotografija-iscrpljenih-talijanskih-lijecnika/,False ,Images that were used belong to a campaign in Mexico for healtworkers rights
3/13/2020,Croatia,Faktograf,propolis cures COVID-19,FB,in article,https://faktograf.hr/2020/03/13/ne-propolis-ne-ubija-koronavirus-covid-19/,False ,There is no evidence to support this claim
3/13/2020,Croatia,Faktograf,a secret invasion of 40 thousand american troops immune to COVID-10 is ongoing in EUrope,FB,https://archive.li/Qcreq,https://faktograf.hr/2020/03/14/sto-se-doista-dogada-oko-iskrcavanja-americke-vojske-u-europi/,False ,A secret invasion of 40 thousand American troops on Europe is not happening
3/14/2020,Croatia,Faktograf,corporations invented the coronavirus,FB,in article,https://faktograf.hr/2020/03/15/nema-dokaza-da-su-korporacije-izumile-covid-19/,False ,there is no evidence to support this claim
3/15/2020,Croatia,Faktograf,COVID-19 arrived in the US by train,FB,in article,https://faktograf.hr/2020/03/16/vagon-vlak-covid-19-teorija-zavjere/,False ,the photo has been manipulated
3/13/2020,Croatia,Faktograf,COVID-19 is a human made/ american biological weapon,FB,https://archive.li/M90f2,https://faktograf.hr/2020/03/16/ne-koronavirus-nije-americko-biolosko-oruzje-usmjereno-protiv-kine/,False ,Scientific reseach shows that the virus is not human made
3/13/2020,Croatia,Faktograf,Croatian president tells people to buy in bulk for at least 2 weeks,FB,https://archive.li/M90f2,https://faktograf.hr/2020/03/16/ne-predsjednik-milanovic-nije-pozvao-gradane-da-kupe-zalihe-hrane-za-dva-tjedna/,False ,the president did not say you should buy food to sustain you for two weeks
2/24/2020,Croatia,Faktograf,The link between COVID-19 and 5G is being hidden,FB,https://archive.li/nTi8U,https://faktograf.hr/2020/03/16/korona-virus-5g-ivijesti/,False ,the link is not being hidden because it doesnt exist
3/10/2020,Croatia,Faktograf,Coronavirus is actually chemtrail lungs,FB,http://archive.li/qWsgQ,https://faktograf.hr/2020/03/17/chemtrails-pluca-koronavirus/,False ,chemtrail lungs do not exist as a condition
3/18/2020,Croatia,Faktograf,wash your throat with salted water and apple vineger to cure COVID-19,FB,in article,https://faktograf.hr/2020/03/19/ispiranje-grla-slanom-vodom-ili-jabucnim-octom-ne-pomaze-protiv-koronavirusa/,False ,who and other medical institutions say this is not a cure
3/18/2020,Croatia,Faktograf,"spanish scientist says go to ronaldo or messi for the cure, you pay them more",fb,http://archive.li/SjtC7,https://faktograf.hr/2020/03/19/bivsa-spanjolska-ministrica-nije-napala-ronalda-i-druge-skupo-placene-nogometase/,False ,the former spanish minister for agriculture never said this
3/19/2020,Croatia,Faktograf,"you should leave your shoes outside, they carry the virus",Whatsapp,in article,https://faktograf.hr/2020/03/19/ne-zbog-koronavirusa-cipele-ne-morate-ostavljati-izvan-stana/,False ,official sources say this is not true
3/19/2020,Croatia,Faktograf,images showing coffins of COVID-19 victims in Italy,FB,in aricle,https://faktograf.hr/2020/03/19/facebookom-se-sire-lazne-fotografije-lijesova-stradalih-od-covid-19-u-italiji/,False ,images in question were actually taken in 2013
3/19/2020,Croatia,Faktograf,chinese claim that the virus was created in 2015 in US,FB,http://archive.li/bCrvt,https://faktograf.hr/2020/03/19/koronavirus-wuhan-vojne-igre-nature-kina-sad/,False ,theres no evidence that supports this claim
3/15/2020,Croatia,Faktoraf,Cristiano Ronaldo turned his hotels into hospitals,FB,multiple sources,https://faktograf.hr/2020/03/16/cristiano-ronaldo-nije-svoje-hotele-pretvorio-u-bolnice-zbog-koronavirusa/,False ,the claim is false
1/27/2020,France,France 24 Observers,Video showing a woman eating a bat soup in Wuhan,"YouTube, Tik Tok users, anonymous",https://perma.cc/7YAH-LN4Y,https://observers.france24.com/fr/20200130-intox-chine-soupe-chauve-souris-rumeur-origine-coronavirus,False ,Video shot in Palau in 2016
1/27/2020,France,France 24 Observers,Video showing a man eating a bat soup in a restaurant in China,"Weibo, Instagram anonymous authors",https://perma.cc/87E2-4WQY,https://observers.france24.com/fr/20200130-intox-chine-soupe-chauve-souris-rumeur-origine-coronavirus,False ,With identified many elements in the video that matched pictures published by Chinese bloggers who visited Palau and documented their trip.
1/27/2020,France,France 24 Observers,Filipinos eating bat soup in Wuhan,YouTube anonymous user,https://perma.cc/AJH5-LAVQ,https://observers.france24.com/fr/20200130-intox-chine-soupe-chauve-souris-rumeur-origine-coronavirus,False ,YouTubers made the video last July in Palau
1/27/2020,France,France 24 Observers,Bat market and bat meat being sold in Wuhan,Instagram anonymous user,https://perma.cc/R4J8-PVNX,https://observers.france24.com/fr/20200130-intox-chine-soupe-chauve-souris-rumeur-origine-coronavirus,False ,Video taken in Indonesia (Manado)
1/27/2020,France,France 24 Observers,"Video of Wuhan market with dogs, snakes, rats and bats... ",YouTube anonymous user,https://perma.cc/RT45-4KPJ,https://observers.france24.com/fr/20200130-intox-chine-soupe-chauve-souris-rumeur-origine-coronavirus,False ,Video taken in Indonesia (Langowan)
2/1/2020,France,France 24 Observers,"caption on YouTube: ""doctor affected by the virus hospital wuhan china""",YouTube + Twitter,https://perma.cc/6ENA-PKD9,https://observers.france24.com/fr/20200204-chine-medecin-coronavirus-hopital-wuhan-yunnan,False ,"Prior instances of the video had captions, confirmed by media reports, said the video showed a doctor collapsing in Yunnan province because of overwork and hypoglycemia. "
1/27/2020,France,France 24 Observers,Video showing a woman eating a bat soup in Wuhan (different video and person),"Twitter, Facebook, YouTube, TikTok, Instagram users, anonymous",https://perma.cc/CKT2-T3WK,https://observers.france24.com/fr/20200130-intox-chine-soupe-chauve-souris-rumeur-origine-coronavirus,Unverified,"We tracked the girl's social media accounts, confirmed they were authentic. She claims the video was taken over the summer but wouldn't tell were. The set up and meal look like Palau traditionnal bat soup but we couldn't confirm. "
1/27/2020,France,France 24 Observers,Close-up of a bat soup bowl that is eaten in China/Wuhan,"Twitter, Facebook, YouTube, TikTok, Instagram users, anonymous",https://perma.cc/XMQ9-KRN3,https://observers.france24.com/fr/20200130-intox-chine-soupe-chauve-souris-rumeur-origine-coronavirus,Unverified,"A local source in Palau said he recognized a specific local restaurant. Table, room setting and plates' decorations match with other pictures found online showing tourist dining in unspecified restaurant in Palau. Not enough elements for us to call it false but pretty close. "
3/13/2020,France,France 24 Observers,People panicking bout a COVID-19 case at the Dakar Airport,Facebook users,deleted,https://observers.france24.com/en/20200313-senegal-coronavirus-debunked-people-panic-covid-19-case-dakar-airport,False ,this footage has nothing to do with the coronavirus pandemic and was taken out of context from a Senegalese TV footage showing an exercise.
2/28/2020,France,France 24 Observers,Chinese police use a fishing net to arrest a man with a high fever,Twitter user,https://twitter.com/SoumayyaY/status/1231933351667343360,https://observers.france24.com/en/20200228-china-video-police-fishing-net-arrest-coronavirus-covid-fake-news,False ,The video shows  a police training exercise.
Fed 19,France,France 24 Observers,Chinese police kill a woman escaping a COVID-19 quarantine in China,Twitter user,https://twitter.com/jenniferatntd/status/1224551214756646914,https://observers.france24.com/en/20200219-china-police-kill-woman-escape-quarantine-covid-19,False ,The scene actually shows a motorbike accident.
2/11/2020,France,France 24 Observers,People lying on the ground because in China because they got coronavirus,Facebook and Tik Tok users,https://www.facebook.com/khalid.elmoura/videos/2343870299052884/,https://observers.france24.com/fr/20200210-intox-video-coronavirus-chine-attention-afrique-sud,False ,Video comes from South Africa during a initiation rite in a private school.
2/21/2020,France,France 24 Observers,Chinse people fleeing China to Vietnam because of coronavirus.,Twitter user,https://twitter.com/arslan_hidayat/status/1230201281173708802,https://observers.france24.com/fr/20200221-coronavirus-intox-hordes-chinois-fuient-vietnam-courant,False ,People are actually going from Vietnam to China for work.
3/10/2020,France,France 24 Observers,First patient healed in Algeria,Facebook user,not available,https://observers.france24.com/fr/20200310-intox-virales-afrique-autour-coronavirus-decryptees,False ,The man is from Morocco and appears in a TV add for an hospital in Morocco.
3/10/2020,France,France 24 Observers,Senegalese president and government appears with masks during a press conference.,Facebook users in Senegal,not available,https://observers.france24.com/fr/20200310-intox-virales-afrique-autour-coronavirus-decryptees,False ,The picture is digitally edited to add the masks.
3/11/2020,France,France 24 Observers,Panic scene in Germany with people rushing into a supermarket.,Facebook,not available,https://observers.france24.com/fr/20200311-coronavirus-manifestations-scenes-panique-intox-venues-europe,False ,The video is taken during the sales.
3/11/2020,France,France 24 Observers,Demonstrations against Chinese people in Italy.,Twitter user,https://twitter.com/zhiwei1221/status/1231378870080696320,https://observers.france24.com/fr/20200311-coronavirus-manifestations-scenes-panique-intox-venues-europe,False ,Anti-fascist demonstration on February 22 in Roma.
3/11/2020,France,France 24 Observers,Racist scene against Chinese people in the metro in Belgium.,Facebook users,not available,https://observers.france24.com/fr/20200311-coronavirus-manifestations-scenes-panique-intox-venues-europe,False ,"Vidéo is an excerpt of the Youtube channel ""Would you react"" with actors."
3/12/2020,France,France 24 Observers,OMS staff member is spreading coronavirus on purpose.,Twitter,https://twitter.com/yanwang10508606/status/1236472761129807873,https://observers.france24.com/fr/20200312-coronavirus-attention-ces-intox-alimentent-theories-complot,False ,"The man is an astrophysician, and he is touching this lady because she is his girlfriend, and she is sick."
3/13/2020,France,France 24 Observers,Picture showing the Mecca totally empty.,Facebook user,not available,https://observers.france24.com/fr/20200313-coronavirus-intox-monde-arabe-observateurs-mecque-saddam-hussein,False ,The picture is from a miniature designed by an artist.
3/13/2020,France,France 24 Observers,Saddam Hussein explaining what is coronavirus about.,Facebook,https://www.facebook.com/hayan.cheaib/videos/2806675992720477/,https://observers.france24.com/fr/20200313-coronavirus-intox-monde-arabe-observateurs-mecque-saddam-hussein,False ,Sound has been edited. It's a video from 2003 where Saddam Hussein is talking about the USA/Irak war.
3/16/2020,France,France 24 Observers,35 italians tourist don't want to leave Ethiopia and go back in Italy bexause of Coronavirus,24jours.com,http://www.24jours.com/35-touristes-italiens-refusent-de-rentrer-chez-eux/,https://observers.france24.com/fr/20200316-africa24-info-24jours-com-reseau-desinformation-clickbait-afrique,Misleading,Testimonies seems to be invented and the characters quoted does not exist. The website is well known for clickbait content and false stories.
3/18/2020,France,France 24 Observers,A train carrying vaccines with an inscription Covid-19,Facebook users,https://www.facebook.com/regardsurlemondeofficiel/photos/a.445307292588310/896806234105078/?type=3&__xts__%5B0%5D=68.ARDgmnCUbtQ0wWs79qjYI-dtwT8hZpwzrzTPbenOBMk3j0vIIBkQUH2EQW43ZLTeZ3zOduSgKlLZWW4KE1P2HN7NerwOP4WoZpXga9IRKtphq7Uy20QHu6tqUTtWaKd4mu5fDm93iomTAeLeNUSpugQkZPeZO3pg_Wy737Fjprslga07jubi6EF3CiYowO_vSD3eM2gdNnEDfeWK1ppTPu7ga8TjXNqio97i8kdHLWdTBZMif4fHueDkn9RszCmhcXEzzG4gldjXHiwbfMImiDqjKxCzsvsr1KqfPgC_x-tb60IgVn8q946dluJk_yUVf1hglH-5sNmLCO0wOFtiSQc&__tn__=-R,https://observers.france24.com/fr/20200318-train-stocke-vaccin-covid-19-attention-intox-coronavirus,False ,"Content seems to be digitally edited, and there is no inscription on that location on such trains."
1/27/2020,France,franceinfo,A package from AliExpress sent from China can spread the new coronavirus,Multiple Twitter accounts + Messages on franceinfo.fr news feed,https://twitter.com/search?q=%23AliExpress&src=typeahead_click,https://www.francetvinfo.fr/sante/maladie/coronavirus/coronavirus-un-colis-en-provenance-de-chine-peut-il-transmettre-la-maladie_3801681.html,False ,"The coronavirus need a living host to grow. This kind of virus lives only a few days in a liquid and only a few hours on an object. The virus would die during the long transport from China to France, for example. The scientist never observed this king of contamination before with any kind of coronavirus."
1/27/2020,France,franceinfo,The coronavirus was created and patented by an American lab two years before this epidemy,Multiple Twitter accounts,https://twitter.com/sylviefourcade/status/1219858018835275777,https://www.francetvinfo.fr/replay-radio/le-vrai-du-faux/le-coronavirus-de-wuhan-a-t-il-ete-brevete-deux-ans-avant-lepidemie-de-2020_3801437.html,False ,These pre-existing patents are referring to other viruses and coronaviruses
1/31/2020,France,franceinfo,"Scientists and experts answer questions and rumors about the coronavirus (bat soup, Wuhan P4 Laboratory, patented virus, people collapsing, etc) ",,not available,https://www.francetvinfo.fr/sante/maladie/coronavirus/coronavirus-2019-ncov-on-a-passe-au-microscope-les-rumeurs-qui-se-sont-propagees-sur-les-reseaux-sociaux_3804367.html,False ,Please click the link to read the full article
2/11/2020,France,franceinfo,Cats and dogs can be infected and can contaminate humans with Covid-19,Twitter,not available,https://www.francetvinfo.fr/sante/maladie/coronavirus/coronavirus-2019-ncov-les-animaux-domestiques-peuvent-ils-transmettre-la-maladie_3821295.html,False ,"There is no evidence that pets such as dogs or cats can be infected with the new coronavirus, say WHO and French medical experts"
1/24/2020,France,franceinfo,A Chinese woman from Wuhan arrived in France with suspected symptoms of coronavirus,Multiple Twitter accounts,https://twitter.com/Conflits_FR/status/1220033933838032896?s=20,https://www.francetvinfo.fr/sante/maladie/coronavirus/une-chinoise-venue-de-wuhan-est-elle-arrivee-en-france-avec-des-symptomes-suspects-du-coronavirus_3798295.html,Misleading,"The Chinese embassy in France confirmed the presence of this Chinese woman in France and said that she gave reassuring news. According to French authorities, investigations are underway, but this suspicious case has never been officially reported."
1/29/2020,France,franceinfo,Statistics are predicting millions of dead peoples and billions of infected people in a few days,Twitter acounts,https://twitter.com/David_vanH/status/1222027173843873792?s=20,https://www.francetvinfo.fr/replay-radio/le-vrai-du-faux/pourquoi-les-graphiques-alarmants-diffuses-sur-les-reseaux-sociaux-sur-le-coronavirus-2019-ncov-sont-faux_3800361.html,Misleading,There is no modelization of the virus yet. So it's impossible to predict anything about the epidemic.
1/31/2020,France,franceinfo,"franceinfo hosted a chat with a scientist in order to answer questions about the coronavirus, including fake news",,not available,https://www.francetvinfo.fr/sante/maladie/coronavirus/il-est-tres-peu-probable-qu-une-epidemie-d-ampleur-se-propage-en-france-un-epidemiologiste-de-l-inserm-a-repondu-a-vos-questions-sur-le-coronavirus_3806903.html,Explanatory,Please click the link to read the full article
3/11/2020,France,franceinfo,Why it's dangerous to make your own hand sanitizer at home,youtube,https://www.youtube.com/watch?v=Xi3VA-Vmjmg,https://www.francetvinfo.fr/sante/maladie/coronavirus/coronavirus-pourquoi-fabriquer-son-propre-gel-hydro-alcoolique-peut-etre-dangereux_3860313.html,Misleading,It's dangerous to create your own hand sanitizer at home but DIY videos dont' tell you that.
3/10/2020,France,franceinfo,Do Americans have to pay 3000 or 4000 $ for a day of containment ?,franceinfo,https://www.francetvinfo.fr/replay-radio/8h30-fauvelle-dely/les-mesures-du-gouvernement-contre-le-coronavirus-les-consultations-a-distance-les-italiens-confines-le-8h30-franceinfo-d-olivier-veran_3841801.html,https://www.francetvinfo.fr/replay-radio/le-vrai-du-faux/coronavirus-les-americains-confines-doivent-ils-vraiment-payer-des-frais-de-3-000-a-4-000-dollars-la-journee_3860375.html,Misleading,Some Americans had to pay 3000 or 4000 $ after being contained in hospital.
3/9/2020,France,franceinfo,Did the French Health minister underestimate the risk of contamination in France ?,twitter,https://twitter.com/AiphanMarcel/status/1234579952328232962?ref_src=twsrc%5Etfw%7Ctwcamp%5Etweetembed%7Ctwterm%5E1234579952328232962&ref_url=https%3A%2F%2Fwww.francetvinfo.fr%2Freplay-radio%2Fle-vrai-du-faux%2Fcoronavirus-agnes-buzyn-a-t-elle-sous-estime-le-risque-de-propagation-en-france_3851495.html,https://www.francetvinfo.fr/replay-radio/le-vrai-du-faux/coronavirus-agnes-buzyn-a-t-elle-sous-estime-le-risque-de-propagation-en-france_3851495.html,Misleading,"The French Health minister really said that the risk of seeing the virus spreading in France was almost equal to zero, but it was at the very beginning of the outbreak in China and her statement was consistent with the datas she had."
3/7/2020,France,franceinfo,Is it true that people can't use the right of withdrawal at work because of the outbreak ?,medias,https://www.bfmtv.com/mediaplayer/video/coronavirus-pour-jean-michel-blanquer-le-droit-de-retrait-des-professeurs-ne-s-applique-pas-dans-cette-situation-1227711.html,https://www.francetvinfo.fr/sante/maladie/coronavirus/epidemie-de-coronavirus-le-gouvernement-a-t-il-raison-quand-il-dit-que-le-droit-de-retrait-ne-s-applique-pas_3853291.html,Misleading,"French labor law experts think that the risk of being infected with the virus at work can be a reason to refuse going back to work in some cases, but not all."
3/7/2020,France,franceinfo,Did the coronavirus mutated and became more agressive ?,franceinfo.fr,not available,https://www.francetvinfo.fr/sante/maladie/coronavirus/epidemie-de-coronavirus-une-mutation-a-t-elle-rendu-le-covid-19-plus-agressif_3853581.html,Misleading,"Chinese scientists discovered that this coronavirus has taken two different types. They suggest that the second type could be more aggressive. But this is only a theory, never tested in lab and French scientists consider that there no really important mutation of the virus yet"
3/5/2020,France,franceinfo,Does France underestimate the outbreak ?,twitter,https://www.francetvinfo.fr/image/75rw42myv-ed9d/633/703/21079707.png,https://www.francetvinfo.fr/sante/maladie/coronavirus/coronavirus-la-france-sous-estime-t-elle-le-nombre-de-cas_3853661.html,Misleading,"On social networks, many users claim that the number of coronavirus cases in France is underestimated, because there are fewer tests in France than elsewhere. But this international comparison is not really relevant."
2/12/2020,France,franceinfo,"Will the coronavirus epidemic disappear in April thanks to the heat, as Donald Trump said ?",twitter,https://twitter.com/atrupar/status/1226915470667849730?ref_src=twsrc%5Etfw%7Ctwcamp%5Etweetembed%7Ctwterm%5E1226915470667849730&ref_url=https%3A%2F%2Fwww.francetvinfo.fr%2Fmonde%2Fusa%2Fpresidentielle%2Fdonald-trump%2Fl-epidemie-de-coronavirus-covid-19-va-t-elle-disparaitre-en-avril-grace-a-la-chaleur-comme-l-assure-donald-trump_3821821.html,https://www.francetvinfo.fr/monde/usa/presidentielle/donald-trump/l-epidemie-de-coronavirus-covid-19-va-t-elle-disparaitre-en-avril-grace-a-la-chaleur-comme-l-assure-donald-trump_3821821.html,Misleading,"It's impossible to predict the evolution of this epidemi, because this coronavirus is a new virus. Weather probably plays a role, but it remains to be determined among other factors."
2/11/2020,France,franceinfo,Can pets contaminate humans ?,franceinfo.fr,not available,https://www.francetvinfo.fr/sante/maladie/coronavirus/coronavirus-2019-ncov-les-animaux-domestiques-peuvent-ils-transmettre-la-maladie_3821295.html,Misleading,"According to the WHO, there is no evidence that dogs or cats can be infected with the new coronavirus. French medical experts confirm that a virus crossing the species barrier is rare."
3/5/2020,France,franceinfo,"No, a confidential governmental document does not prove that the government has decided to postpone local elections because of the outbreak",facebook + twitter,https://twitter.com/LremTon/status/1233879180426739717?ref_src=twsrc%5Etfw%7Ctwcamp%5Etweetembed%7Ctwterm%5E1233879180426739717&ref_url=https%3A%2F%2Fwww.francetvinfo.fr%2Fsante%2Fmaladie%2Fcoronavirus%2Fcoronavirus-non-un-document-confidentiel-du-gouvernement-ne-prevoit-pas-le-report-des-municipales-a-cause-de-l-epidemie_3851953.html,https://www.francetvinfo.fr/sante/maladie/coronavirus/coronavirus-non-un-document-confidentiel-du-gouvernement-ne-prevoit-pas-le-report-des-municipales-a-cause-de-l-epidemie_3851953.html,False ,This document is a fake. The government didn't take this decision
2/27/2020,France,franceinfo,The far right leader Marine Le Pen says that the EU did't do anything against the outbreak,radio,https://twitter.com/franceinter/status/1232568594418061317?ref_src=twsrc%5Etfw%7Ctwcamp%5Etweetembed%7Ctwterm%5E1232568594418061317&ref_url=https%3A%2F%2Fwww.francetvinfo.fr%2Fsante%2Fmaladie%2Fcoronavirus%2Fcoronavirus-l-union-europeenne-a-t-elle-ete-inactive-comme-le-dit-marine-le-pen_3843717.html,https://www.francetvinfo.fr/sante/maladie/coronavirus/coronavirus-l-union-europeenne-a-t-elle-ete-inactive-comme-le-dit-marine-le-pen_3843717.html,False ,"The EU has activated the civil protection mechanism,  launched aid program, mobilizes funds for research and called for more international cooperation and coordination"
2/26/2020,France,franceinfo,Is it useful to close borders to stop the outbreak ?,media and social medias,https://twitter.com/MLP_officiel/status/1231912919216132098,https://www.francetvinfo.fr/sante/maladie/coronavirus/covid-19-la-fermeture-des-frontieres-est-elle-une-mesure-efficace-pour-lutter-contre-l-epidemie_3840565.html,False ,"French medical experts say closing borders in order to prevent infected people from entering in France is ineffective. Likewise, health tests before entering the country have little effect."
