3/20/2020,India,Newschecker,The United States of America threatened Iraq with Coronavirus in 1990.,Twitter,https://twitter.com/Africarevolt/status/1239881000127209472?s=20,https://www.newschecker.in/article/news-detail/275_15296317,False ,"According to the AP Archive description, Saddam Hussein said, “If God wills it and we have to run after the enemy, then we will do it.” Also, in AP’s description, we found that Saddam Hussein did not refer to the word ‘Coronavirus’ in the original video."
3/20/2020,India,Newschecker,A WhatsApp forward is doing the rounds which claims that Prime Minister Narendra Modi called for a 14-hour long ‘Janta Curfew’ on 22 March from 7 am to 9 pm because the lifespan of the coronavirus at one place is only 12 hours and if we all follow the Janta Curfew religiously then the chain will be broken,WhatsApp,https://drive.google.com/open?id=1R8ET6lOrmUtgD8qNwkuUD9ZYMc34IZMg,https://www.newschecker.in/article/news-detail/275_15296110,Misleading,"There is no clear information on the lifespan of the novel coronavirus. However, various study reports have suggested a similar lifespan as that of other coronaviruses. PM Modi’s motive behind calling for a ‘Janta Curfew’ was just to curb the spreading of novel coronavirus and the Government has not claimed that the Janta Curfew is called to kill the virus hence the claim turned out to ‘Misleading’ in our fact-check."
3/21/2020,India,Newschecker,"Seeing the rise of novel coronavirus in India, the World Health Organization (WHO) has recommended the government of India to lockdown the country from April 15 to June 15.",WhatsApp,https://soundcloud.com/shaminder-singh-mahi/whatsapp-audio-2019-11-19-at-122633-online-audio-convertercom,https://www.newschecker.in/article/news-detail/275_15307002,False ,"we reached out to one of the representatives in India, who rubbished the claim and clarified that WHO has not made any such recommendation."
3/21/2020,India,Newschecker,"A video is doing the rounds in already flooded WhatsApp groups. It is being claimed that the lady shown in the video is the wife of Canada’s PM Justin Trudeau. In the viral video, a lady can be seen describing her improved condition because of medication and also warns to not take chances.",WhatsApp/Facebook,https://m.facebook.com/story.php?story_fbid=2808930289144861&id=100000837528194?sfnsn=wiwspmo&extid=sNtbyUftTy9GFkW3&d=n&vh=i,https://www.newschecker.in/article/news-detail/275_15308597,False ,The lady in the viral video is not Canadian PM Justin Trudeau’s wife Sophie Grégoire Trudeau but a British national namely Tara Jane Langston.
2/19/2020,India,Newschecker.in,Chinese converting to Islam after realising that no muslim was affected by #Coronavirus #COVD19 in the country,Twitter,https://twitter.com/Diced__/status/1229004089213833216?s=20,https://www.newschecker.in/article/news-detail/275_14901149,False ,The viral video is old and not related to coronavirus
1/30/2020,India,Newschecker.in,A Parasite Removal Video Shared In Relation With Coronavirus,Recevied on WhatsApp,not available,https://www.newschecker.in/article/news-detail/275_14649851,Misleading,"The video was uploaded on YouTube on October 24, 2019 with the title “Amazing Botfly Removal on Lips”."
2/29/2020,India,Newschecker.in,Russia announces the closure of airspace and suspension of all its incoming and outgoing flights to China.,Whatsapp/twitter,https://twitter.com/venkatananth/status/1233644831785668608?s=20,https://www.newschecker.in/article/news-detail/275_15029421,Misleading,"Russian government had imposed some temporary and partial ban on the movement of Chinese nationals. All Russian airlines, with the exception of national airline Aeroflot (AFLT.MM), stopped flying to China from Jan. 31. Small airline Ikar will also continue flights between Moscow and China. All planes arriving from China will be sent to a separate terminal in the Moscow Sheremetyevo airport. Aeroflot reduced the frequency of flights to Beijing, Shanghai, and Guangzhou until Feb. 29"
1/28/2020,India,NewsMobile,A video has gone viral on social media which claims to feature one of the victims of the deadly virus,Facebook,https://www.facebook.com/golla.sivasankara/videos/2518954378347437/,http://newsmobile.in/articles/2020/01/28/this-viral-video-is-not-related-to-the-coronavirus-heres-the-fact-check/,False ,"The same video was posted YouTube on October 24th, 2019, which was before the first case of Coronavirus got reported in China in December 2019."
1/30/2020,India,NewsMobile,A video of a girl is being shared on social media where she collapsed in a store and claims are being made that she was affected by Coronavirus,Facebook,https://www.facebook.com/hingminashieikhoi2019/videos/2356873471085471/,http://newsmobile.in/articles/2020/01/30/fact-check-the-girl-in-the-viral-video-did-not-die-because-of-coronavirus/,False ,Incident is from Malaysia and the girl has been identified as Nur Izzah Izzati. Malaysia’s Health Ministry also confirmed that the claim attached with the video is fake
1/31/2020,India,NewsMobile,"Video shows a market in the Chinese city of Wuhan, where the deadly Coronavirus strain emerged",Facebook,https://www.facebook.com/venkata.krishna.359/videos/2576346659154309/,http://newsmobile.in/articles/2020/01/31/this-viral-video-of-a-meat-market-is-not-from-wuhan-heres-the-fact-check/,False ,The video actually shows a market in Indonesia’s Sulawesi island.
2/2/2020,India,NewsMobile,Picture of people lying on the street is being shared online with a caption that implies that the picture is related to the recent outbreak of Coronavirus in China,Facebook,https://www.facebook.com/tuko.pamoja.10/posts/776289222778075,http://newsmobile.in/articles/2020/02/02/fact-check-this-viral-picture-of-people-lying-on-the-street-is-not-relate-to-coronavirus-outbreak-in-china/,False ,The picture was taken in Frankfurt when people participated in an art protest to pay tribute to the lives lost in the Nazi concentration camps in 2014
2/4/2020,India,NewsMobile,Video shows bat infestation under a tiled roof claims to be the source of Coronavirus in China's Hubei,Facebook,https://www.facebook.com/jj.jayaraman/videos/2458866854224830/,http://newsmobile.in/articles/2020/02/04/this-viral-video-does-not-show-the-source-of-coronavirus-heres-the-truth/,False ,The viral video is eight-year-old and it is not from China
2/5/2020,India,NewsMobile,Chinese PM visited mosque following Coronavirus outbreak,Facebook,https://www.facebook.com/mujjor.rahman/videos/2590054847897170/,http://newsmobile.in/articles/2020/02/05/chinese-pm-didnt-visit-mosque-following-coronavirus-outbreak-heres-the-fact-check/,False ,"The man in the viral video is former Malaysian Prime Minister, Abdullah Ahmad Badawi. The video was shot during his visit to China when he visited Beijing’s Nan Xia Po Mosque in July 2015"
2/6/2020,India,NewsMobile,China is seeking court’s approval to kill all who were tested positive with Coronavirus,Twitter,https://twitter.com/AF_indian/status/1225475839975940100?ref_src=twsrc%5Etfw%7Ctwcamp%5Etweetembed%7Ctwterm%5E1225475839975940100&ref_url=http%3A%2F%2Fnewsmobile.in%2Farticles%2F2020%2F02%2F07%2Fchina-seeking-courts-approval-to-kill-the-over-20000-coronavirus-patients-no-this-news-is-fake%2F,http://newsmobile.in/articles/2020/02/07/china-seeking-courts-approval-to-kill-the-over-20000-coronavirus-patients-no-this-news-is-fake/,False ,the official website of the National Health Commission of the People’s Republic of China uploaded the daily brief on coronavirus and there was no mention of any such case there
2/6/2020,India,NewsMobile,A picture of a Dettol disinfectant spray is being shared online in which the label on the back of a bottle shows the product claiming to have been proven to ‘kill coronavirus’ and that they knew about the new strain since 2019,Facebook,https://www.facebook.com/dharmesh.patel.796/posts/3351843924829848,http://newsmobile.in/articles/2020/02/06/did-dettol-know-about-the-new-novel-coronavirus-before-the-outbreak-heres-the-truth/,False ,"The recent outbreak of coronavirus in China is a strain named 2019-nCoV. For this particular strain, the source of infection, animal host and reservoir are currently unknown"
2/7/2020,India,NewsMobile,Chinese President Xi Jinping visited mosque amid Coronavirus outbreak and requested the people of the Muslim community to pray ‘in present crisis,Facebook,https://www.facebook.com/drfazalahmed/videos/3213770805304616/,http://newsmobile.in/articles/2020/02/07/chinese-prez-visited-mosque-amid-coronavirus-outbreak-heres-the-truth-behind-the-viral-video/,False ,Chinese President Xi Jinping’s visit to the mosque is not related to Coronavirus as the viral video is almost-four-year-old.
1/28/2020,Spain,Newtral.es,This video showing a market of animals claims to be filmed in Wuhan,Facebook posts,https://www.facebook.com/993728330799673/videos/490494048273834/?__tn__=%2CO,https://www.newtral.es/coronavirus-el-video-que-dice-mostrar-imagenes-del-mercado-de-wuhan-esta-grabado-en-indonesia/20200128/,False ,Please click the link to read the full article
1/29/2020,Spain,Newtral.es,Coronavirus killed 10.000 people in Wuhan,The Geller Report,https://twitter.com/RobinDeEspacio/status/1221905610477883394?s=20,https://www.newtral.es/es-falso-que-haya-informes-sobre-mas-de-10-000-muertos-en-wuhan-a-causa-del-coronavirus/20200129/,False ,Please click the link to read the full article
1/30/2020,Spain,Newtral.es,Chain message with a notification from the Spaniard department of Health,WhatsApp and Fb,not available,https://www.newtral.es/el-ministerio-de-sanidad-no-ha-emitido-ninguna-notificacion-de-emergencia-sobre-el-coronavirus/20200130/,False ,The Spaniard heatlh department did not issue that notification
1/31/2020,Spain,Newtral.es,Canadian Department of Health issues emergency notification that asks people to drink warm water,"WhasApp, Facebook and website",https://www.claudiaarellanob.com/boletin-salud/?fbclid=IwAR2CtDXpnuX6LXLu5SO9SnHkUywy0xfx_rfbxXPZhTMjicUkw5cNOoaUzkE,https://www.newtral.es/el-departamento-de-salud-de-canada-no-ha-aconsejado-mantener-la-garganta-humeda-para-evitar-el-contagio-del-coronavirus/20200131/,False ,The notification was not issued by the Department of Health of Canada
1/31/2020,Spain,Newtral.es,China builds a hospital in 48 hours for Coronavirus patients,Facebook and website,https://www.larazon.es/sociedad/20200129/dtxqerhaybaslnpye4fe4yunrm.html?fbclid=IwAR26IaEi2kNGIxBabqR2GF8Xg4JjCUA9-o8JswQ3nevxL99vuOb5LUGY3ug,https://www.newtral.es/china-no-ha-construido-un-hospital-en-48-horas-para-atender-a-pacientes-del-coronavirus-lleva-en-construccion-desde-2018/20200131/,False ,The building has been in construction since 2018. What China has done is accomodate the building with 1.000 beds for coronavirus pacients
1/31/2020,Spain,Newtral.es,Bill Gates funds institute hold patent and Bill Gates predicted outbreak and 65 Million Deaths,Multple websites and social media users,https://www.periodistadigital.com/politica/opinion/20200128/hay-detras-coronavirus-miedo-tenernos-controlados-intereses-farmaceuticas-pandemia-diezmar-poblacion-noticia-689404249246/,https://www.newtral.es/no-hay-pruebas-de-que-bill-gates-sea-el-propietario-de-la-patente-de-la-nueva-cepa-del-coronavirus/20200131/,False ,The work that Bill & Melinda Gates Foundation does on healthcare has in no way contributed to the spread of coronavirus.
2/3/2020,Spain,Newtral.es,Video shows a doctor that faints while operating coronavirus because he got infected,Twitter,https://twitter.com/RSTV_anfitrion/status/1223194189128708096?s=20,https://www.newtral.es/es-falso-que-este-video-muestre-medicos-que-caen-mientras-operan-a-un-paciente-con-coronavirus/20200203/,False ,Symptoms do not show inmediatly and accoding to chinese media he fainted because he spent 17 hours operating
2/4/2020,Spain,Newtral.es,There is a person with coronavirus in Galicia,Facebook Users,https://www.facebook.com/photo.php?fbid=3065299176859953&set=a.416188461771051&type=3&theater,https://www.newtral.es/no-hay-un-infectado-del-coronavirus-en-noia-galicia/20200204/,False ,"According to the Spanish Health Ministry, there is just one case of coronavirus in Spain until now. The image has been manipulated and La Voz de Galicia hasn´t published that article"
2/4/2020,Spain,Newtral.es,There is a person with coronavirus in Huelva,Twitter user,https://twitter.com/pacomeros_/status/1224328112311357448?s=20,https://www.newtral.es/es-falso-que-se-haya-detectado-un-caso-de-coronavirus-en-huelva/20200204/,False ,"According to the Spanish Health Ministry, there is just one case of coronavirus in Spain until now. The image has been manipulated and RTVE hasn´t published that information"
2/4/2020,Spain,Newtral.es,Is it safe to receive a letter or a package from China?,Reader question,not available,https://www.newtral.es/es-seguro-recibir-paquetes-que-provienen-de-china-segun-explica-la-oms/20200204/,False ,"According to the WHO and other experts, people receiving packages from China are not at risk of contracting"
2/5/2020,Spain,Newtral.es,A picture show people in China fainted on the Street after they got infected of the Coronavirus,Facebook post,https://www.facebook.com/permalink.php?story_fbid=159148522175405&id=107817853975139,https://www.newtral.es/la-imagen-de-una-concentracion-en-alemania-contra-el-nazismo-que-se-usa-para-desinformar-sobre-el-coronavirus/20200205/,False ,The pictures was actually taken in 2014 in Germany during a concentration to remember holocaust victims
2/10/2020,Spain,Newtral.es,A person with coronavirus in Andorra,Facebook,https://www.facebook.com/photo.php?fbid=2673646412670551&set=a.376620859039796&type=3&theater,https://www.newtral.es/no-te-creas-el-montaje-de-una-supuesta-noticia-sobre-un-caso-de-coronavirus-en-andorra/20200210/,False ,"At 10th february, there is no confirmed case of coronavirus in Andorra."
2/12/2020,Spain,Newtral.es,Germans quarantined in La Gomera by the Coronavirus leave home isolation without permission,Facebook,https://www.facebook.com/Gonzalotenerife/posts/610052686219214,https://www.newtral.es/los-alemanes-en-cuarentena-en-la-gomera-por-el-coronavirus-no-han-abandonado-sin-permiso-el-aislamiento-domiciliario/20200212/,False ,"The Ministry of Health of the Canary Islands denies they have returned to Germany
"
2/13/2020,Spain,Newtral.es,"A person with coronavirus in Calella, Barcelona",whatsApp,not available,https://www.newtral.es/no-hay-un-caso-de-coronavirus-en-calella-barcelona/20200213/,False ,Please click the link to read the full article
2/19/2020,Spain,Newtral.es,Chinese elderly couple infected with coronavirus say goodbye while they are in a hospital,"Social media, website",https://elcaso.elnacional.cat/es/sucesos/coronavirus-video-abuelos-contagiados-despiden-viral_26259_102.html,https://www.newtral.es/no-hay-pruebas-de-que-esta-pareja-de-ancianos-se-salude-por-ultima-vez-al-estar-afectados-por-el-coronavirus/20200219/,False ,The elderly couple hospitalized for other conditions such as lung cancer and respiratory failure
2/25/2020,Spain,Newtral.es,Bats that hide under Wuhan rooftops caused the Covid-19 outbreak,Message text + video,not available,https://www.newtral.es/el-video-de-un-tejado-con-una-plaga-de-murcielagos-no-tiene-nada-que-ver-con-el-coronavirus-fue-grabado-en-eeuu-en-2011/20200225/,False ,The video was recorded in the US in 2011
2/26/2020,Spain,Newtral.es,New cases of Coronavirus in Madrid linked to two universities and a club,Sent via WhatsAoo,not available,https://www.newtral.es/no-te-creas-estas-noticias-sobre-el-coronavirus-en-una-discoteca-de-madrid-icade-o-ceu-y-que-falsifican-la-web-de-el-mundo/20200226/,False ,Images of articles published by El Mundo related to Coronavirus were manipulated
2/26/2020,Spain,Newtral.es,Two cases confirmed of Coronavirus in Huelva (Andalucía),Sent via WhatsApp and Facebook posts,https://www.facebook.com/photo.php?fbid=2741101512649137&set=pcb.2741101575982464&type=3&theater,https://www.newtral.es/no-hay-dos-casos-confirmados-de-coronavirus-en-el-hospital-juan-ramon-jimenez-de-huelva-ni-lo-han-cerrado-a-cal-y-canto/20200226/,False ,Andalusian health ministry denied cases of Coronavirus in the Spanish region
2/4/2020,Spain,Newtral.es,We made a Q&A of what we know about the videos of people fainting in the middle of the street,-,-,https://www.newtral.es/que-sabemos-de-los-videos-en-los-que-se-ve-a-gente-desmayarse-supuestamente-por-el-coronavirus/20200205/,Explanatory,-
2/27/2020,Spain,Newtral.es,Sevilla's university has suspended classes because of Coronavirus,WhatsApp,not available,https://www.newtral.es/universidad-sevilla-coronavirus-suspende-clases-bulo/20200227/,False ,The institution denied it on its twitter account
2/27/2020,Spain,Newtral.es,A monkey is been infected with coronavirus in this photo,Twitter,deleted,https://www.newtral.es/no-a-este-mono-no-le-estan-inyectando-el-coronavirus-para-comprobar-despues-el-efecto-del-remdesivir-una-posible-vacuna/20200227/,False ,The photo is a capture of a video taken at least two months before the first symtoms of COVID-19
2/27/2020,Spain,Newtral.es,Doctor Gerardo Dovakin found a vaccine agains coronavirus,Facebook,https://www.facebook.com/groups/681603291884776/permalink/3047018818676533/,https://www.newtral.es/es-falso-que-el-doctor-gerardo-dovakin-haya-descubierto-una-vacuna-contra-el-coronavirus/20200228/,False ,"He is actually an actor, not a doctor"
2/28/2020,Spain,Newtral.es,Video of a person infected with Coronavirus being detained by the police,Facebook,No link (deleted),https://www.newtral.es/nos-preguntais-por-el-video-de-un-supuesto-control-de-trafico-en-china-para-detectar-infectados-por-coronavirus/20200228/,False ,"This video of a person infected with Coronavirus being detained by the police is not real, it´s a drill. It was shot last February 21 at Henan Tongbai by the police and the emergency response team. "
2/14/2020,Spain,Newtral.es,A video of a chinese epidemiologist saying that there are millions of infected,Twitter,not available,https://www.newtral.es/bulos-coronavirus-wuhan-casos-videos-teorias-conspiranoicas/20200225/,,"The video was longer than the version shared in Twitter. The epidemiologist said that if chinese Government had not taken action, there would be millions of infected by Coronavirus"
2/28/2020,Spain,Newtral.es,"A man with a gas mask at a supermarket in Lugo (Galicia, Spain)",Twitter,https://twitter.com/ismiiita/status/1232784516252565505?s=20,https://www.newtral.es/mascara-supermercado-lugo-bulo-austria/20200228/,False ,"The picture was taken in Austria, not Spain."
2/28/2020,Spain,Newtral.es,Barcelona's council issued a notification of a new focus in two neighborhoods,WhatsApp,-,https://www.newtral.es/el-ayuntamiento-de-barcelona-no-ha-emitido-un-comunicado-advirtiendo-de-focos-de-coronavirus-en-el-barrio-de-sants-o-en-santa-eulalia/20200228/,False ,The council denied on its twitter account
2/28/2020,Spain,Newtral.es,The wife of a Chinese shop owner of Totana (Murcia) has Coronavirus,WhatsApp,No link (WhatsApp),https://www.newtral.es/bulo-coronavirus-totana-cuarentena/20200228/,False ,She did not have the virus
3/1/2020,Spain,Newtral.es,Facemasks prevent from getting infected,,not available,https://www.newtral.es/la-mascarilla-para-quien-la-necesita-por-que-usarlas-sin-cumplir-recomendaciones-de-sanidad-perjudica-a-otros-pacientes/20200301/,False ,Health authorities does not recommend using facemask unless direct contact with a positive
3/3/2020,Spain,Newtral.es,CDC recommends men shave their beards to protect against coronavirus.,CNN,https://twitter.com/CNNChile/status/1232803235880218624?s=20,https://www.newtral.es/barba-mascarilla-coronavirus/20200303/,False ,A 2017 CDC infographic shows how facial hair could interfere with respirator masks. The graphic is unrelated to coronavirus protection and the CDC has not recommended people should shave their beards to ward off the virus.
1/28/2020,Spain,Newtral.es,"There is an alert of coronavirus in Madrid, Barcelona o Valencia",Twitter account,https://twitter.com/SoyFede_/status/1222111183005679616?s=20,https://www.newtral.es/no-hay-ninguna-alerta-de-coronavirus-en-madrid-valencia-o-barcelona-lo-difunde-una-cuenta-falsa-de-twitter-que-se-hace-pasar-por-el-pais/20200128/,False ,There are no cases of Coronavirus detected in Spain
1/30/2020,Spain,Newtral.es,"WHO advises to avoid ""unprotected sex"" with animals",Twitter,https://twitter.com/Jorgebuxade/status/1222469065991761920?s=20,https://www.newtral.es/la-oms-no-ha-aconsejado-evitar-tener-sexo-sin-proteccion-con-animales-para-evitar-el-contagio-del-coronavirus/20200130/,False ,"It is a manipulated imagen, WHO confirmed"
1/30/2020,Spain,Newtral.es,Video of a doctor fainted on the floor after getting infected with Coronavirus,Facebook and Twitter,https://twitter.com/Finanzas_Time/status/1220518126808379397,https://www.newtral.es/un-video-de-otra-ciudad-china-usado-para-crear-alarma-sobre-el-coronavirus/20200130/,False ,The doctor was in the floor because the familiy of the patient punched him after he was not able to save him after he had a heart attack
2/4/2020,Spain,Newtral.es,Dr Zhong Nanshan said that saline solution can kill the virus,WhatsApp and Facebook,https://www.facebook.com/giorgio.baldeon/posts/3094911920520111,https://www.newtral.es/enjuagarse-la-garganta-con-agua-salada-no-previene-la-neumonia-de-wuhan/20200204/,False ,"Several chinese media debunk that fake. Moreover, experts say it is not true,"
3/5/2020,Spain,Newtral.es,86 clients of a brothel in quarentine after a prostituted tested positive in coronavirus,Facebook post,https://www.facebook.com/carlosgonzalezlacosta/posts/818035722026549,https://www.newtral.es/coronavirus-prostibulo-valencia-bulo/20200303/,False ,It was a satire from a web of humour
3/6/2020,Spain,Newtral.es,Increasing frontieres controls will stop coronavirus from spreading,Multiple politicians,https://twitter.com/Santi_ABASCAL/status/1232244153670676480?s=20,https://www.newtral.es/la-propuesta-de-cerrar-fronteras-para-frenar-contagios-preguntas-y-respuestas/20200305/,False ,Neither WHO or CDC estimate that closing frontieres will stop de coronavirus
3/9/2020,Spain,Newtral.es,Viral claims propogating UNICEF Message About Coronavirus,WhatsApp,-,https://www.newtral.es/consejos-unicef-coronavirus-bulo/20200309/,False ,UNICEF denied the organization issued this images
3/9/2020,Spain,Newtral.es,The bill for a coronavirus test in the US is 3.000$,Facebook,https://magnet.xataka.com/,https://www.newtral.es/el-test-del-coronavirus-en-eeuu-no-cuesta-3-000-dolares-aunque-la-factura-asociada-a-la-prueba-puede-ser-alta/20200309/,False ,CDC is not making people pay the test by now
3/9/2020,Spain,Newtral.es,This Lysol desinfectant against coronavirus shows the virus is not new,Facebook,https://www.facebook.com/williams.tovilladiaz/videos/1551700001649780/,https://www.newtral.es/no-una-etiqueta-del-desinfectante-lysol-no-demuestra-que-el-coronavirus-actual-siempre-ha-existido-como-dice-un-video-viral/20200309/,False ,The desinfectant refers to the other types of coronavirus.
3/9/2020,Spain,Newtral.es,A doctor called Lupita Yamamoto Lupercio found the coronavirus vaccine,Facebook,https://www.facebook.com/photo.php?fbid=10221443747464188&set=a.1194530064481&type=3,https://www.newtral.es/vacuna-coronavirus-sandra-oh-anatomia-de-grey-bulo/20200309/,False ,"The person in the picture is actually Sandra Oh, an actress from Grey's Anatomy. Also, there is no vaccine against coronavirus yet"
3/10/2020,Spain,Newtral.es,Madrid's government has announced students will have to make-up classes during summer,WhatsApp and Twitter,https://twitter.com/jeloujlo/status/1237159528958959616?s=20,https://www.newtral.es/no-te-creas-el-fotomontaje-que-dice-que-la-comunidad-de-madrid-va-a-recuperar-clases-en-julio-o-abril/20200310/,False ,Madrid's government hasn't announced the students will have to make-up classes during summer: the shared photo is fake
3/10/2020,Spain,Newtral.es,Galicia suspended classes because of coronavirus,Twitter,https://archive.vn/HdNvW,https://www.newtral.es/galicia-clases-suspendidas-bulo/20200310/?utm_content=buffer995d0&utm_medium=social&utm_source=twitter.com&utm_campaign=buffer,False ,Galicia did not suspended clases on 10th march
3/10/2020,Spain,Newtral.es,Empty supermarket in Madrid after measures announced against coronavirus,Twitter and WhatsApp,https://twitter.com/ChicagorraVlogs/status/1237137100400713728?s=20,https://www.newtral.es/coronavirus-videos-de-saqueos-que-son-de-otros-paises-y-alertas-falsas-sobre-desabastecimiento-en-supermercados/20200310/,False ,"The images were recorded in CHile, not in Spain"
3/10/2020,Spain,Newtral.es,"Manuela Carmena, ex major of Madrid, got infected of Coronavirus",Tweet,It was deleted,https://www.newtral.es/el-pais-no-ha-tuiteado-que-manuela-carmena-ha-dado-positivo-en-coronavirus-es-una-cuenta-falsa/20200310/,False ,The tweet imitated El Pais official account and Más País denied she was infected
3/10/2020,Spain,Newtral.es,Thieves in Madrid pretending to be doctors to steal in people's houses,WhatsApp,not available,https://www.newtral.es/no-hay-pruebas-de-que-una-banda-de-ladrones-disfrazados-de-medicos-esten-entrando-en-domicilios-para-hacer-pruebas-por-coronavirus-y-asi-cometer-robos/20200310/,False ,"National Police of Madrid explained that there is no complaint that describes a similar case. ""The note was made by the president of a neighborhood association that saw similar events on television but in a country abroad, not in Spain, so it is a hoax,"" they say."
3/11/2020,Spain,Newtral.es,Seven ambulance workers infected with coronavirus in Catalonia,WhatsApp,No link,https://www.newtral.es/tecnicos-ambulancias-cataluna-coronavirus-bulo/20200311/,False ,Health ministry of Catalonia explained that there are no ambulance workers infected
