3/17/2020,Colombia,Colombiacheck,China announced that it “successfully” developed the coronavirus vaccine ”and that“ its large-scale production ”is already being prepared,Text,https://twitter.com/RedMasNoticias/status/1240003829254500353,https://colombiacheck.com/chequeos/china-aun-no-tiene-lista-vacuna-contra-coronavirus-covid-19,False ,"Today, March 17, China announced that a possible vaccine will undergo human testing. But it is still missing so that it can begin to occur ""on a large scale"", as several media headlined. China still has no coronavirus vaccine list (Covid-19)"
3/17/2020,Colombia,Colombiacheck,"the “coronavirus, before reaching the lungs, remains in the throat for four days” and that “gargling with hot water and salt or vinegar will eliminate the virus”.",Text and Image,https://www.facebook.com/permalink.php?story_fbid=532060397692003&id=100026641413250,https://colombiacheck.com/chequeos/hacer-gargaras-con-agua-y-sal-no-elimina-el-coronavirus-covid-19,False ,"The SARS-CoV-2 coronavirus does not ""stay four days"" in the throat, and gargling with water and salt is not an effective method of preventing the Covid-19 disease that it produces."
3/17/2020,Colombia,Colombiacheck,"There is a study that establishes the relationship between ibuprofen and the severity of the virus infection. . . apparently what Ibuprofen does is facilitate the reproduction of the virus """,Audio and Text,https://www.facebook.com/cosasdechicashoy/posts/3604795012928021,https://colombiacheck.com/chequeos/no-hay-evidencia-cientifica-solida-que-indique-que-ibuprofeno-empeora-el-coronavirus,Partially false,There is no solid scientific evidence to indicate that Ibuprofen worsens the Coronavirus.
3/16/2020,Colombia,Colombiacheck,"To identify if we are infected with the coronavirus, it is possible to self-examine every morning: Inhale deeply and hold your breath for more than 10 seconds. If you can do it without coughing, without discomfort, poor ventilation indicates that there is no fibrosis in the lungs, basically indicating that there is no infection. ”",Text,https://www.facebook.com/canaldenoticias3hd/posts/2580405858949135,https://colombiacheck.com/chequeos/sostener-la-respiracion-por-10-segundos-no-ayuda-identificar-infeccion-por-covid-19,False ,Holding your breath for 10 seconds does not help identify Covid-19 infection
3/19/2020,Colombia,Colombiacheck,The WHO recommended that all countries go into quarantine to combat Covid-19,Url,https://www.larepublica.co/globoeconomia/la-oms-recomendo-a-todos-los-paises-declararse-en-cuarentena-para-combatir-covid-19-2980017?utm_medium=Social&utm_source=Facebook&fbclid=IwAR1pmGqzIqkMxAQUoFR9quW7D703IeQlekDAdTVxCKovd5BAonKiepbRgu4#Echobox=1584553112,https://colombiacheck.com/chequeos/no-oms-no-recomendo-todos-los-paises-todos-los-paises-declararse-en-cuarentena-para,False ,"In networks and the media, it has been stated that the World Health Organization, WHO, ""recommended that all countries declare themselves in quarantine to combat Covid-19"". However, the WHO itself denied it."
3/19/2020,Colombia,Colombiacheck,A video shows the Russian leader giving a speech with captions that make him believe he is rebuking world leaders.,Facebook and Twitter,https://www.facebook.com/viviana.botina/videos/10219276600439931/,https://colombiacheck.com/chequeos/el-video-de-putin-con-subtitulos-falsos-en-espanol,False ,"A video is being moved on Facebook and Twitter in which Vladimir Putin, the President of Russia, is seen giving a speech in front of a crowd. The video is accompanied by Spanish subtitles that make it appear that you are criticizing the leaders of other countries for their recent actions. Some social network users even shared the video as if this were Putin's response to the handling that other countries have given to the coronavirus outbreak."
3/19/2020,Colombia,Colombiacheck,The coronavirus was created in a biological laboratory in Wuhan,Youtube and Facebook,https://www.youtube.com/watch?v=0IkS_PrALoU&t=154s,https://colombiacheck.com/chequeos/no-hay-evidencia-de-que-el-coronavirus-venga-de-un-laboratorio-biologico-de-wuhan,False ,"There is no evidence that 'the coronavirus comes from a biological laboratory in Wuhan,' as claimed by Mexican youtuber Alexander Backman."
1/30/2020,Germany,Correctiv,What if it's not a virus but 5G that is causing disease and deaths?,Website,https://connectiv.events/wuhan-erste-provinz-mit-vollstaendiger-5g-abdeckung-jetzt-das-zentrum-des-toedlichen-virus/,https://correctiv.org/faktencheck/medizin-und-gesundheit/2020/01/30/falsche-spekulationen-5g-ist-nicht-schuld-an-todesfaellen-durch-das-coronavirus,False ,The deaths from COVID-19 had nothing to do with 5G
2/7/2020,Germany,Correctiv,Taking chlorine dioxide helps against Coronavirus,Websites,https://www.rainer-taufertshoefer-medizinjournalist.de/STUDIE_Chlordioxid_CDL_CDS_CDI_inaktivieren_Coronavirus,https://correctiv.org/faktencheck/medizin-und-gesundheit/2020/02/07/die-einnahme-von-chlordioxid-hilft-nicht-gegen-das-neue-coronavirus,False ,Taking chlorine dioxide does not help against the coronavirus or against other diseases. It is harmful.
1/27/2020,Germany,Correctiv,New strain of Virus already patented / Bill Gates funds institute which hold patent and Bill Gates predicted outbreak and 65 Million Deaths,Website,http://archive.is/CQImP,https://correctiv.org/faktencheck/medizin-und-gesundheit/2020/01/28/nein-bill-gates-hat-kein-patent-auf-das-neue-coronavirus-oder-den-ausbruch-mit-65-millionen-toten-vorhergesagt,Mostly false,"There are many patents for corona viruses, but those are for different strains, not the one that recently broke out in China. Bill Gates has not predicted the outbreak."
1/27/2020,Germany,Correctiv,"The Seafood Marked is the source of the novel Coronavirus, strange animals and foods were sold there, such as batsoup and snakes.",Website,http://archive.is/d3hEZ,https://correctiv.org/faktencheck/medizin-und-gesundheit/2020/01/28/keine-belege-dass-ein-markt-mit-exotischen-tieren-in-wuhan-der-ursprung-des-neuen-coronavirus-war,Unproven,"It is possible that animals transmitted the virus to people. Many of the first patiens had visited the market. However, a direct link has not yet been proven."
1/27/2020,Germany,Correctiv,That everything is much worse than reported; that current virus is worse than SARS; that media is not reporting enough; that people are falling over from virus in the streets; ...,YT-channel,https://www.youtube.com/watch?v=XAqAv843DF4&t=323s,https://correctiv.org/faktencheck/medizin-und-gesundheit/2020/01/28/coronavirus-irrefuehrendes-youtube-video-verbreitet-sich-ueber-whatsapp,Partially false,"The video is spreading unproven, misleading and partly false claims about the outbreak of the new Coronavirus."
2/14/2020,Germany,Correctiv,China orders citizens to abandon/kill their pets as they can transmit Coronavirus,Pet Lovers Website,https://www.deine-tierwelt.de/magazin/coronavirus-china-ordnet-schlachtung-von-haustieren-an/,https://correctiv.org/faktencheck/medizin-und-gesundheit/2020/02/14/coronavirus-chinesische-behoerden-fordern-nicht-haustiere-zu-schlachten-teilweise-werden-aber-strassenhunde-getoetet,Partially false,"There is no proof, that chinese authorities have ordererd the killing of pets; however, there is proof that some chinese authorities have apporved killings of stray dogs and cats in order to stop the spreading of the virus. The WHO says that right now there is no evidence that the virus can be transmitted through pets."
3/14/2020,Germany,Correctiv,"37.000 US soldiers are entering the EU while everybody is busy with the coronavirus, the soldiers are immune",Facebook post,https://www.facebook.com/permalink.php?story_fbid=231270748057490&id=100035236981978,https://correctiv.org/faktencheck/2020/03/20/nein-29-000-us-soldaten-sind-nicht-immun-gegen-das-coronavirus,Mainly false,"the Nato exercise Defender Europe 20 is no secret exercise, there are only 29.000 US soldiers and media reported about it for months. Further, it was stopped because of the Coronavirus outbreak - soldiers are not immune"
3/18/2020,Germany,Correctiv,A photo shows coffins of people who died because of Coronavirus in Italy - it shows that the virus is dangerous and you should stay inside,Facebook post,https://www.facebook.com/photo.php?fbid=2480177468901123&set=a.1382026885382859&type=3&theater,https://correctiv.org/faktencheck/2020/03/20/dieses-foto-zeigt-keine-saerge-von-menschen-die-in-italien-durch-das-coronavirus-gestorben-sind,Mainly false,the photo is old and shows coffins of migrants who drowned at a boat accident at Lampedusa in 2013. But the appeal to stay inside to avoid infection with coronavirus is correct.
3/18/2020,Germany,Correctiv,Jobcenters (for unemployed people) close from today on,gegen-hartz.de,https://www.gegen-hartz.de/news/hartz-iv-ab-heute-alle-jobcenter-wegen-corona-krise-geschlossen,https://correctiv.org/faktencheck/2020/03/18/jobcenter-schraenken-arbeit-wegen-coronavirus-ein-aber-schliessen-nicht-komplett,Mostly true,"the jobcenters are not completely closed, the offer personal contact in emergency cases"
2/29/2020,Germany,Correctiv,"Germany gave medical protection equipment like masks to China, now it's missing in Germany",Journalistenwatch,https://www.journalistenwatch.com/2020/02/29/stuemper-heiko-maas/?fbclid=IwAR08cFAUdOpPDr5RllJgYtvcfc_9Yki6zMy8I_2JP9uNhyVqlj24Ym0D_ek&__cf_chl_jschl_tk__=5ac48653fe7bc817f1e1ed77191d720c5e98a8c0-1583018728-0-AZVj3UPBNjeqla40Ix29b3_VGRK9Z1ccXGHO_5ql_s8RYrEYh7wPe7R8zbkOm-zRlMl46i44peM8jXtrwGXi8iGYTq1P3tsfLqMVnLVMb-UcUrXZNDrwDCvwQ2S2N-ZWWAF73bDv5EDh4dJtZmGp6dIQnNmlgD5gepEBlv-1AjqAnnOL4s64evqN-5x27CfBD4_bYQFeoFVcmdB54XJOYSg2Nxw5x91OqnnbdmX0IecozoRjMrQ6RQfAMZWc7GYZR4r8ifAELAPaJwVuWwyHZNKASvSWcqO08rqsRs8ut4aNsZsDkyFe4ZEywh3f1Jbdbl3KtatnxZddJRo2BPHXwZqwnJzqaV9Jhxe8IGS1lOi0OhGRbzR7rnOz0Wxl5qQT4zY-IJw02w9ry00Hx6RXcXo,https://correctiv.org/faktencheck/2020/03/05/coronavirus-ja-deutschland-hat-schutzausruestung-nach-china-geschickt,Correct,Germany sent protection equipment to China twice in February
2/29/2020,Germany,Correctiv,the Coronavirus is more dangerous for animals than for humans,Frankfurter Neue Presse,https://www.fnp.de/deutschland/coronavirus-gefahr-haustiere-katze-hund-schuetzen-zr-13524079.html,https://correctiv.org/faktencheck/2020/03/04/coronavirus-keine-hinweise-dass-haustiere-staerker-gefaehrdet-sind-als-menschen,Unproven,There is no proof that animals can get or spread the new Coronavirus
2/29/2020,Germany,Correctiv,Video shows people storming a Aldi supermarket to buy groceries because of Coronvirus fear,TikTok user,https://www.tiktok.com/@ihanaids/video/6798539433525153030?u_code=d86c0f09554jki&preview_pb=0&language=de&timestamp=1583416262&utm_campaign=client_share&app=musically&utm_medium=ios&user_id=6734004853343028230&tt_from=copy&utm_source=copy&source=h5_m,https://correctiv.org/faktencheck/2020/03/05/video-diese-menschen-stuermten-aldi-nicht-wegen-des-coronavirus-sondern-wegen-laptops,Wrong,The video was made in 2011 and shows people who wanted to buy laptops at an Aldi store in Kiel
3/4/2020,Germany,Correctiv,The first dog was infected with Coronavirus,Wamiz,https://wamiz.de/neuigkeiten/20336/coronavirus-alarm-hund-erstmals-positiv-getestet-hundehalter-in-sorge?fbclid=IwAR1Yd-D32mTP6jMcD7hDy8SaP6lTxrxGw2npx__UYMkFGztxKVxtUGEYwsw,https://correctiv.org/faktencheck/2020/03/04/ja-ein-hund-in-hongkong-wurde-positiv-auf-das-coronavirus-getestet,Correct,A dog in Hong Kong was tested weakly positive for Coronavirus but didn't show any symptoms so far
2/29/2020,Germany,Correctiv,This virus is old because bottle of desinfectant from 2015 shows „Coronavirus“,Facebook users,https://www.facebook.com/photo.php?fbid=2793043027409347&set=a.318363121544029&type=3&theater,https://correctiv.org/faktencheck/2020/03/13/coronavirus-steht-auf-desinfektionsmitteln-weil-die-viren-familie-schon-seit-jahrzehnten-bekannt-ist,False ,Please click the link to read the full article
3/10/2020,Germany,Correctiv,Tips agains Coronavirus like holding your breath and drinking water,Whatsapp users,-,https://correctiv.org/faktencheck/2020/03/18/coronavirus-um-was-es-bei-dem-angeblichen-geheimplan-der-regierung-2012-wirklich-ging,False ,"these tips are wrong, they don't prevent infection with coronavirus"
3/14/2020,Germany,Correctiv,the University hospital in Vienna found out that Ibuprofen speeds up the spreading of the coronavirus,Whatsapp users,-,https://correctiv.org/faktencheck/2020/03/16/coronavirus-keine-belege-dass-ibuprofen-eine-erkrankung-verschlimmert,Unproven,the voice message tells an untrue story and it is not clear whether Ibuprofen can have a negative effect. There is no proof so far that if affects Covid-19 patients
2/28/2020,Germany,Correctiv,"German government made a ""secret plan"" about Coronavirus in 2012 that foretold the pandemic",wallstreet-online.de,https://www.wallstreet-online.de/nachricht/12224423-corona-geheimplan-regierung-entdeckt,https://correctiv.org/faktencheck/2020/03/18/coronavirus-um-was-es-bei-dem-angeblichen-geheimplan-der-regierung-2012-wirklich-ging,Partially false,there is no secret plan but a public risk assessment of the German government on 2012 that contained a hypothetical epidemic of a fictional coronavirus named Modi-SARS
3/15/2020,Germany,Correctiv,"A video shows an Italian doctor who says that nobody died only from Coronavirus in Italy, that it's not more dangerous than a flu",Youtube,https://www.youtube.com/watch?v=AFUEF6PRHRY&fbclid=IwAR3rbv98NqHDeAIjqs-vQb8W38jAiRzxGRJkpOC1tjXWivlTjxE7axipuAk,https://correctiv.org/faktencheck/2020/03/20/dieses-video-interview-eines-arztes-aus-italien-ist-von-februar-und-enthaelt-veraltete-zahlen,False ,the video is from February when there were only 11 deaths by Coronavirus in Italy. It is not possible to say whether people with prior diseases die only because of the virus. But studies show that also healthy people died so far
3/17/2020,Germany,Correctiv,Although Germany closes its borders refugees and migrants may still come in and they will not be medically checked for Coronavirus,philosophia-perennis.com,https://philosophia-perennis.com/2020/03/17/corona-krise-fuer-asylbewerber-sind-die-deutschen-grenzen-noch-voellig-offen/,https://correctiv.org/faktencheck/2020/03/20/coronavirus-ja-asylbewerber-sind-vom-einreisestopp-ausgenommen-sie-sollen-aber-getestet-werden,Partially false,"Asylum seekers may under certain circumstances still come to Germany, but they are not the only persons allowed to cross the border. And there will be medical checks if they are infected"
2/27/2020,Germany,Correctiv,WHO says Coronavirus might be spread via food,Medizin Heute,https://medizin-heute.net/der-naechste-coronavirus-schock-laut-weltgesundheitsorganisation-koennte-uebertragung-durch-lebensmittel-moeglich-sein?fbclid=IwAR3bvwqjfxsNXxMUVML9MNllzU_5xI0UxrtPJcF5dC4P2W6jeSlta9Zi-lo,https://correctiv.org/faktencheck/2020/02/27/nein-die-who-hat-keine-hinweise-dass-das-coronavirus-ueber-lebensmittel-uebertragen-wird,Teilweise falsch,The WHO has no hints so far that infections with Coronavirus via food are possible.
2/2/2020,Canada,Décrypteurs,"QQ accidentally showed that the real death toll is 25,000 people",Various sources,https://www.taiwannews.com.tw/en/news/3871594,https://ici.radio-canada.ca/nouvelle/1509581/coronavirus-qq-tencent-deces-erreur-morts-faux,False ,"Epidemiologists say that such a high death rate is impossible at this time. Also, with the inspection tool availabl on most browsers, we were able to create an exact copy of the screenshot."
1/25/2020,Canada,Décrypteurs / Radio-Canada,The virus was created by humans and patented,Many users,https://twitter.com/Jordan_Sather_/status/1219795721286586368,https://ici.radio-canada.ca/nouvelle/1493617/coronavirus-laboratoire-complot-brevet-vaccin-bill-gates,False ,The patents exist but are not for the current coronavirus
1/25/2020,Canada,Décrypteurs / Radio-Canada and CBC,Chinese scientists expelled from a Canadian microbiology lab took the coronavirus with them to China,https://twitter.com/Jkylebass,not available,https://www.cbc.ca/amp/1.5442376,False ," The two scientists at the National Microbiology Lab (Winnipeg, Canada) are suspected to have sent live Ebola and Henipah viruses to Beijing in March 2019, but it has nothing to do with the coronavirus. They were expelled from the lab, but are not considered spies."
2/3/2020,Lithuania,Delfi Melo Detektorius (Lie Detector),The common flu kills 60 times more people annually than Corona,Facebook/Twitter post,https://twitter.com/sshrivastav16/status/1223482404213424128/photo/1,https://www.delfi.lt/news/melo-detektorius/melas/tiesa-ar-melas-kad-gripas-kasmet-nusinesa-60-kartu-daugiau-gyvybiu-nei-koronavirusas.d?id=83438103,False ,"It is not right to compare common flu to Corona virus because influenza is seasonal virus, we have vaccines for it and the virus is predictable whereas while this new corona virus exists only for few months and nobody could say exactly what is mortality rate from this virus. Even compared to current information about Coronavirus fatality rate, it comes much higher (around 2-3 percent) than common flu (0.01 percent)"
1/27/2020,Poland,Demagog,"156 thousand people died in China due to Coronavirus, 90 thousand in Wuhan itself","Website, anonymous author",https://wolna-polska.pl/wiadomosci/chiny-miasto-wuhan-90-tysiecy-zmarlych-i-rozkaz-strzelania-bez-uprzedzenia-aby-zabic-2020-01?fbclid=IwAR1ZxbiS8st9NRTNOt_h58tBIo6OoQiyoan2GJ4M-w0HH5UjvobJBsT9FBE,https://demagog.org.pl/analizy_i_raporty/to-nieprawda-ze-w-chinach-z-powodu-koronawirusa-zmarlo-156-tysiecy-osob/,False ,"Article was based on Russian YouTube video, which was based on another article written by infamous conspiracy fake-news website. Figures had no reliable source of information."
1/30/2020,Poland,Demagog,Gates Foundation funded development of Coronavirus,"Website, anonymous author",https://wolnemedia.net/koronawirus-z-wuhan-uzyskal-patent-w-2018-r/?fbclid=IwAR2m1ZyaKlwAAg2hP8xu2OEKrKR2LswRUyLrvCZfpHB2Ruhvit6h4sdt6D4,https://demagog.org.pl/analizy_i_raporty/nie-bill-gates-nie-sfinansowal-koronawirusa-z-wuhan/,False ,"Article was based on manipulative connection of facts concerning the Gates Foundation and Pirbright Institute which resulted in misleading context and ultimately, disinformative article."
2/13/2020,Poland,Demagog,Satellite images showing high levels of sulphur dioxide above China are possible evidence of mass cremations of people who have died from coronavirus.,FB fanpages,https://www.facebook.com/pacjenci/posts/616078775633069?__tn__=-R,https://demagog.org.pl/analizy_i_raporty/nie-dane-satelitarne-nie-pokazuja-pracy-krematoriow-w-wuhan/,False ,This is forecast based on historical data. Full Fact analysis was mentioned in our article.
2/25/2020,Poland,Demagog,"People who are not insured have to pay for medical test for coronavirus, so if they can't afford it, they will spread it.",Robert Biedron / Presidential candidate,https://www.facebook.com/RobertBiedron/photos/a.258584244178932/2895559967148000/?type=3&theater,https://demagog.org.pl/wypowiedzi/czy-badanie-na-koronawirusa-jest-platne/,False ,"He included a document from hospital which named the price for voluntary coronavirus test, for those who are not suspected of having coronavirus (they haven't been to affected areas nor they have medical signs of disease). Anyone who IS suspected of having coronavirus, will have medical examination free of charge, no matter if he's insured or not."
,Poland,Demagog,World labs confirm: coronavirus was bioengineered.,Blog (translated and copypasted article),https://forumemjot.wordpress.com/2020/02/19/swiatowe-laboratoria-potwierdzaja-koronawirus-zostal-opracowany-przez-naukowcow/?fbclid=IwAR3nPEhb83N_258zRcPAeDBaQ7xep5VMfh6wCoK_eIQgX5oM8isdVxcUojI,https://demagog.org.pl/analizy_i_raporty/nie-koronawirus-nie-zostal-opracowany-przez-naukowcow/,False ,There is no evidence.
2/5/2020,Poland,Demagog,"""Coronavirus epidemy in Poland""",Website & Facebook Fanpage,https://wlocie.pl/wiadomosci/epidemia-koronawirusa-w-polsce-morawiecki/?fbclid=IwAR1C7sTlZRttRHOU7IdAvj_oa36Jf0fOM37NOFVcf36qr_dvULNLmnKwTKw,https://demagog.org.pl/analizy_i_raporty/premier-nie-zostawia-watpliwosci-epidemia-koronawirusa-w-polsce-falszywy-naglowek/,False headline,"Article has clearly misleading, false headline that is obvious clickbait: ""Prime minister has no doubts: Coronavirus epidemy in Poland"". In the article itself there is no claim or statement said by any of Polish officials that could justify such alarming headline."
3/10/2020,Poland,Demagog,"Fake coronavirus pandemic is a cover-up for the ""5g disease""","Website ""Odkrywamy Zakryte"" and its fanpage",https://www.odkrywamyzakryte.com/falszywa-pandemia-koronawirusa-a-5g/,https://demagog.org.pl/analizy_i_raporty/nie-epidemia-koronawirusa-nie-jest-falszywa-i-nie-ma-zwiazku-z-5g/,False ,There is no link whatsoever between 5G technology and spread of the coronavirus.
3/12/2020,Poland,Demagog,Iranians have published report saying that coronavirus is a biological warfare,Planeta.pl website,https://www.facebook.com/planetafm/posts/10163445636475227,https://demagog.org.pl/analizy_i_raporty/nie-koronawirus-nie-jest-bronia-biologiczna/,False ,FALSE
3/15/2020,Poland,Demagog,Cristiano Ronaldo will turn his hotels into hospitals,Facebook,https://www.facebook.com/FlashScorePL/photos/a.215464678500059/2947871101926056/?type=3&theater,https://demagog.org.pl/analizy_i_raporty/nie-cristiano-ronaldo-nie-przeksztalci-swoich-hoteli-w-szpitale/,False ,Information was published without verification and was denied afterwards.
3/17/2020,Poland,Demagog,Medical University in Vienna has published study regarding ibuprofen and coronavirus,Facebook/Whatsapp,https://www.facebook.com/938907499556740/photos/a.953330791447744/2787060584741413/?type=3&theater,https://demagog.org.pl/analizy_i_raporty/czy-ibuprofen-szkodzi-osobom-z-koronawirusem/,False ,"There was no such study, Medical University of Vienna denied it and rated is as fake news. Relation between ibuprofen treatment and worsening conditions of patients with COVID-19 is still researched but unproven at the moment."
3/17/2020,Poland,Demagog,"An image showing ""Spanish biologist"" who claimed that footballers which earn millions of euros should research the cure for coronavirus","Facebook, Twitter users",https://www.facebook.com/172288729567705/photos/a.743832629079976/1860875684042326/?type=3&__tn__=-R,https://demagog.org.pl/analizy_i_raporty/nie-to-nie-jest-hiszpanska-biolog-mowiaca-o-zarobkach-pilkarzy/,False ,This is not the Spanish Biologist. Her name is Isabel García Tejerina and she is former Spanish Minister of Agriculture.
3/18/2020,Poland,Demagog,Stopping breathing for 10 seconds will help you detect the coronavirus,Facebook fanpage,https://www.facebook.com/CoronaVirusa.fanpage/photos/a.101794104788897/102387648062876/?type=3&__tn__=-R,https://demagog.org.pl/analizy_i_raporty/wstrzymaniem-oddechu-nie-sprawdzisz-czy-masz-koronawirusa/,False ,It won't help you in detecting coronavirus.
3/19/2020,Poland,Demagog,Polish charity organisation WOSP has withdrawn and donation to coronavirus fight in Poland,Facebook user,https://www.facebook.com/photo.php?fbid=347014979593122&set=a.112739109687378&type=3&eid=ARAvr5SOY023p4mvaKkizOiQtEiwKTXwmL6ips6usPUwZqV4--6hEVnkiFj-aCPTcOaDji1EzjCGa35n,https://demagog.org.pl/analizy_i_raporty/nie-wosp-nie-odmowila-wsparcia-walki-z-koronawirusem/,False ,There was no decision of backing down whatsoever. WOSP couldn't possibly donate the money it collected during public gathering as there was clearly stated goal for that gathering that can't be changed afterwards. WOSP is involved in many activities supporting coronavirus fight.
3/20/2020,Poland,Demagog,Romania has changed the law so that those who break the quarantine will face 15 years in prison,"Various Fb posts, article on a website",http://polityczek.pl/uncategorised/12659-rumunia-15-lat-wiezienia-dla-osob-nieprzestrzegajacych-kwarantanny?fbclid=IwAR3VB7K5YkGwYFJNDtqklX45OBrTzlDo-W6fgZe2AO9UNJfZZRpsU1NamHQ,https://demagog.org.pl/analizy_i_raporty/15-lat-wiezienia-dla-lamiacych-kwarantanne-w-rumunii-manipulacja/,Partially false,15 years is maximum potential punishment (from 7 up to 15 years of imprisonment) but not for those who break the quarantine but for those infected who willingly spread contagious disease and it will be proven to result in death of other people.
1/25/2020,Canada,Détecteur de rumeurs,A CBC news report would have said that Chinese scientists from a Canadian lab sent the coronavirus to Wuhan,Kyle Bass,https://twitter.com/Jkylebass/status/1221065421874397185,https://www.sciencepresse.qc.ca/actualite/detecteur-rumeurs/2020/01/28/coronavirus-lie-laboratoire-winnipeg-faux,False ,"Nothing in the CBC report (and 2 subsequent reports) said anything about ""spies"", or even coronavirus, and no link is done between the expulsion of these two scientists in July 2019 and the virus. "
2/3/2020,Canada,Détecteur de rumeurs,3 preliminary studies who became viral on social networks for wrong reasons,FB + TW,https://www.nejm.org/doi/full/10.1056/NEJMc2001468 and  https://www.biorxiv.org/content/10.1101/2020.01.30.927871v2,https://www.sciencepresse.qc.ca/actualite/detecteur-rumeurs/2020/02/07/coronavirus-toutes-etudes-ne-egales,Partially false,"Those are 3 authentic publications, but they were either too preliminary to conclude what they were concluding, or social networks overstated their conclusions. "
