When did you see the claim?,Country,Organization,What did you fact-check?,Who said/posted it?,Link to the original piece,URL to fact-checked article (in your language),Final rating,Explanation
1/29/2020,Lithuania,15min.lt,"Coronavirus made in lab, there were pre-existing patents for a vaccine for novel coronavirus, Bill and Melinda Gates foundation is involved in spreadning the coronavirus etc.","Ugnius Kiguolis, local antivaxer, a businessman",https://www.facebook.com/photo.php?fbid=2527224704185279&set=a.1374802509427510&type=3,https://www.15min.lt/naujiena/aktualu/lietuva/samokslo-teorijos-apie-koronavirusa-jau-lietuvoje-jas-platina-u-kiguolis-56-1267990,False ,Please click the link to read the full article
2/1/2020,Lithuania,15min.lt,U.S. soldier stationed in Lithuania is the first confirmed case of coronavirus in the country.,Facebook users,https://1stbatcavregusblog.wordpress.com/2020/01/31/koronavirusas-lietuvoje-jav-karininkas-sunkios-bukles/?fbclid=IwAR2kYxScdgasKAz_oU4ltDeTDeyWqSjDe43kGPPXY-bncx3lfcLL0Xg1i2g,https://www.15min.lt/naujiena/aktualu/lietuva/melas-apie-uhano-koronavirusu-uzsikretusi-jav-kari-platinamas-feisbuke-56-1270220,False ,Please click the link to read the full article
2/13/2020,Lithuania,15min.lt,COVID-19 was caused by 5G,,"Facebook user, post is now deleted","https://www.15min.lt/naujiena/aktualu/lietuva/ka-bendro-turi-5g-rysys-ir-covid-19-virusas-56-1276056
",False ,There is no proof that 5G network has anything to do with the outbreak of a nover coronavirus.
2/2/2020,Lithuania,15min.lt,"Outbreak of the Wuhan coronavirus is a start of a depopulation programme. This, in turn, is based on Bill and Melinda Gates foundation links to the outbreak.",Minfo.lt and facebook users,https://minfo.lt/pasaulis/straipsnis/koronaviruso-protrukis-kinijoje-prasidejo-depopuliacijos-programa?fbclid=IwAR266IA-I0MvuNv_vThCdLFQ9DsZe09X5wUglvvf68RtRfitq0yczzgTmz0,https://www.15min.lt/naujiena/aktualu/lietuva/samoksla-del-uhano-koronaviruso-tresia-melu-ir-prastu-duomenu-supratimu-56-1270922,,Please click the link to read the full article
2/10/2020,Lithuania,15min.lt,COVID-19 was stolen from Canada by Chinese spies and accidentally released in Wuhan.,"Facebook user,  website",https://www.facebook.com/jolanta.blazyte.54/posts/639438900161244,https://www.15min.lt/naujiena/aktualu/lietuva/snipu-zaidimai-uhano-koronaviruso-kilmes-teorija-pagal-j-blazyte-56-1274274,Fake,Please click the link to read the full article
2/24/2020,Lithuania,15min.lt,A book by D.Koontz (The Eyes of Darkness) predicted covid-19 in 1981.,Facebook,https://www.zinoti.lt/idomybes/busite-sokiruoti-knyga-isleista-1981-metais-numate-koronaviruso-protruki/,https://www.15min.lt/kultura/naujiena/literatura/knygu-galia-apie-koronaviruso-protruki-perspejo-dar-1981-m-286-1281162,False ,"The first edition of the book mentioned that the virus was invented by the Russians, rather then the Chinese. Moreover, real and imaginary viruses have almost nothing in common. "
2/26/2020,Lithuania,15min.lt,"""Letter"" from an uncle in Wuhan claims covid-19 can be cured with hot water",Facebook users,No link,https://www.15min.lt/naujiena/aktualu/lietuva/dedes-patarimas-su-covid-19-kovoti-karstu-vandeniu-nepades-56-1282242,False ,"There is no evidence hot water can cure covid-19, other facts stated in the said letter are not accurate as well"
2/27/2020,Lithuania,15min.lt,"Video showing chinese officials detaining infected citizen, who refused to be checked.","Website, Facbook",https://bukimevieningi.lt/sokiruojantis-vaizdo-irasas-is-kinijos-kinija-su-uzsikretusiais-koronavirusu-nezaidzia-video/?fbclid=IwAR3ewIal6BTV3LrStbgB_KpGovQmXO79GASluOS0QT0qmDxCy4Gjnq-ub4s,https://www.15min.lt/naujiena/aktualu/lietuva/sokiruojantis-vaizdo-irasas-is-kinijos-mokymu-medziaga-56-1282486,False ,"The video does not show a real event, but an exercise. "
2/27/2020,Lithuania,15min.lt,"A text post with instructions from ""a Lithuanian doctor"", giving advice to potentially infected with coronavirus",Facebook,No link (posts deleted after debunking the claim),https://www.15min.lt/naujiena/aktualu/lietuva/atsargiai-itariantiems-susirgus-covid-19-klaidingai-rekomenduoja-likti-namuose-56-1282962,False ,"Text post is a false one since instructions to stay at home if infected were not given out by any authorities, some of the ""facts"" about the disease were straight up made up."
2/28/2020,Lithuania,15min.lt,"A video showing chaos in a shop, claiming that people are panicking after a first confirmed case of coronavirus in Lithuania",Facebook,No link (videos deleted after debunking the claim),https://www.15min.lt/naujiena/aktualu/lietuva/vaizdo-irase-parduotuves-lentynos-sluojamos-ne-lietuvoje-56-1283114,False ,"The video was made in May 2018 in Romania, during a sale at a supermarket."
2/9/2020,Lithuania,15min.lt,Coronavirus is caused by snakes,Facebook and a online website,https://fanpage.lt/2020/02/05/pagaliau-paskelbta-nuo-ko-is-tikro-atsirado-korona-virusas/?fbclid=IwAR1M-Y-XSj6V6aXMNfXJcs4IHnEDv13M_pZvz3hoCb0nNKT4WJN47ReLBj4,https://www.15min.lt/naujiena/aktualu/lietuva/informacijos-nera-taciau-skelbia-zinantys-koronaviruso-saltini-56-1273858,False ,There is conlusive proof that indeed snakes have caused the spread of the Wuhan coronavirus.
3/2/2020,Lithuania,15min.lt,"Outbreak of COVID-19 is a worldwide fake, fatality rate too low for an epidemic, WHO admitted causing SARS outbreak in 2003",,https://minfo.lt/pasaulis/straipsnis/korona-virusas-pasauline-klastote?fbclid=IwAR3Sgw2LtB-Zi4JsqOc2JrPqN5_gbv06O_EhU07mOnsKprcpeWQ4vDMk-mI,https://www.15min.lt/naujiena/aktualu/lietuva/propagandos-apie-covid-19-uzkratas-skleidziamas-simtams-tukstanciu-lietuviu-56-1283992,Misleading,"Thousands of confirmed cases around the globe, virus confirmed in multiple labs, fatality rate greater than that of some of pandemics in the 20th century."
1/30/2020,Lithuania,15min.lt,Authors of a tabletop exercise in Oct 2019 predicted that Wuhan coronavirus might kill 65 million people,Multiple Facebook users,https://www.lrytas.lt/it/laboratorija/2020/01/28/news/skelbia-niura-prognoze-nuo-kiniskojo-koronaviruso-gali-mirti-65-milijonai-zmoniu-13424762/?fbclid=IwAR1PYfcnWsbpuj886swBmOazw6er6flqB3FhfmsbxRbKemHtnxe2K2CHUbM,https://www.15min.lt/naujiena/aktualu/lietuva/prognozes-esa-uhano-koronavirusas-gali-nusinesti-65-mln-gyvybiu-nebuvo-56-1268774,False headline,Please click the link to read the full article
3/9/2020,Lithuania,15min.lt,SARS-CoV-2 can be killed in warmth of 37 degrees Celsius,Major news outler,https://www.lrytas.lt/skonis/mitybos-abc/2020/03/09/news/vienas-nedidelis-mitybos-pokytis-gali-padeti-isvengti-koronaviruso-13901211/,https://www.15min.lt/naujiena/aktualu/lietuva/ne-karstu-vandeniu-ir-saule-koronaviruso-iveikti-nepavyks-56-1287080,False ,There is no confirmed information on what temperatures are dangerous to the virus. Local medical institutions confirmed to have no data on the issue.
3/10/2020,Lithuania,15min.lt,"200 new cases of COVID-19 registered in Lithuania. People are ""cleansed with bleach"" at the Vilnius international airport and are taken to a small tent-town nearby.",Person to person,not available,https://www.15min.lt/naujiena/aktualu/lietuva/melas-apie-koronavirusa-skelbia-kad-vilniaus-oro-uoste-keleiviai-nurengiami-nuogai-purskiami-balikliu-56-1287538,False ,"1 COVID-19 case is confirmed in Lithuania. The has a English text photoshoped instead of the Lithuanian one. Officials claim there was no such ""explosion"" in cases and objective reality at the airport supports that."
3/12/2020,Lithuania,15min.lt,Elderly are left to die in an Italian hospital near Milan,,https://lebionka.blogspot.com/2020/03/italija-vyresni-nei-60-metu-ligoniai.html?spref=fb&fbclid=IwAR2II0_S4egMkxczV8QSFMzA_RAXDuTqO8Y9pv4vsttnoUh28_n-CkhFETQ,15min.lt/naujiena/aktualu/lietuva/ne-vyresnio-amziaus-zmones-italijoje-nera-paliekami-numirti-56-1287984,False ,"Information was based on an audio message circulating via WhatsApp. The message was posted by ""Il Giornale"", which later retracted the message. Niguarda hospital released a statement claiming that the information was false."
3/12/2020,Lithuania,15min.lt,An article claimed that airports and train stations in Lithuania are being closed down,,https://befa.lt/2020/03/12/lietuvoje-del-koronaviruso-uzdaromi-darzeliai-mokyklos-oro-uostai-traukiniai-ir-stotys/?fbclid=IwAR2BRfGwVZ2BuiF9upYkTJGrh3RXpSSP6vo6Is4GcaeEMlo6r3Bk2wLvgYY,https://www.15min.lt/naujiena/aktualu/lietuva/ne-oro-uostai-ir-traukiniu-stotys-lietuvoje-neuzsidaro-56-1288770,False ,The article used a statement by the government which claimed that schools are being closed. Authors of the misleading article added information about airports and train stations in a headlines but used the governments statement as main text
3/12/2020,Lithuania,15min.lt,Vaccine-skeptic COVID-19 with hot water and baking soda.,Andrius Lobovas,https://www.facebook.com/andrius.lobovas/videos/2918081231560639/,https://www.15min.lt/naujiena/aktualu/lietuva/skiepu-priesininkas-skelbia-netiesa-nuo-koronaviruso-karstas-vanduo-ir-soda-neisgelbes-56-1288602,False ,Mortality statistics indicate that seasonal flu is at least 60 times less deadly than COVID-19 (based on current data). Hot water and soda have no proven effects to help combat the novel coronavirus.
3/13/2020,Lithuania,15min.lt,A photo claimed that a Lithuanian town of Mazeikiai is being cut off from the rest of the country due to outbreak of COVID-19,Facebook,not available,https://www.15min.lt/naujiena/aktualu/lietuva/nevykes-pokstas-platina-nuotrauka-neva-mazeikiai-uzdaromi-56-1289074,False ,An original photo shows a sign that informs of a road maintanance project. Whereas the fake one claimed that a city is being cut off.
3/13/2020,Lithuania,15min.lt,A facebook post claimed that a message from Stanford hospital gives advice to frink water every 15 mintes in order to prevent COVID-,Facebook,not available,https://www.15min.lt/naujiena/aktualu/lietuva/melas-feisbuke-daznai-geriamas-vanduo-nuo-koronaviruso-nesaugo-56-1289124,False ,A statement from the Standforf hospital distanced themselves from the fake message.
3/13/2020,Lithuania,15min.lt,"An image on facebook claimed that hundreds of infected people are hidden in Lithuanian hospitals, it claimed that people are taken to crematorium.",Facebook,not available,https://www.15min.lt/naujiena/aktualu/lietuva/paklydes-pokstas-skelbia-feisbuko-troliu-informacija-apie-covid-19-lietuvoje-56-1289288,False ,The original message was published by a prank generating facebook account and repackaged to look as if it was real.
3/14/2020,Lithuania,15min.lt,"A photo claimed that military vehicles are combating COVID-19 in Palermo, Italy.",Facebook,not available,https://www.15min.lt/naujiena/aktualu/lietuva/sicilijoje-pastebeta-karine-technika-su-koronaviruso-protrukiu-nesusijusi-56-1289536,Partially false,"Sicilian media wrote that military indeed driving through Palermo, but vehicles were comng back from a military exercise and had nothing to do with the virus as at the time there were a handful of confirmed COVID-19 cases in Sicily."
1/27/2020,Australia,AAP FactCheck,A Saudi Arabian study for a MERS vaccine is linked to the outbreak of Coronavirus,Individual facebook account,"Archived: http://archive.is/aAv1f
Original: https://www.facebook.com/photo.php?fbid=2229069974064149&set=a.1423371221300699&type=3&theater",https://factcheck.aap.com.au/social-media-claims/saudi-mers-vaccine-study-is-not-related-to-2020-coronavirus-outbreak,False ,"Based on the evidence, AAP FactCheck found the Facebook post to be false. The Saudi clinical trial is investigating a vaccine for the MERS Coronavirus strain, not the 2019 Novel Coronavirus."
1/27/2020,Australia,AAP FactCheck,"Post claims food products such as rice, fortune cookies, mi goreng noodles, ice tea and ""Chinese red bull"" are contaminated with coronavirus. Also some areas of Sydney are supposedly identified as contaminated.",Facebook user,https://archive.is/bBTNO,https://factcheck.aap.com.au/social-media-claims/post-makes-false-claims-about-coronavirus-in-foods-at-train-stations,False ,AAP FactCheck found the Facebook post to be false. A viral infectious diseases expert says there is no evidence of food being a source of any coronavirus transmission. The Facebook post also lists information from the “Department of Diseasology Parramatta” conducting tests showing “positive readings” for the virus at train stations in four Sydney suburbs. NSW Health confirmed to AAP FactCheck there is no such organisation as the “Department of Diseasology Parramatta” and there have been no “positive readings” at train stations.
1/28/2020,Australia,AAP FactCheck,"Claim that a ""Wuhan super virus"" originated in a Chinese biosecurity lab and has infected more than 100,000 in Wuhan","Facebook page called ""STFN Reloaded""",http://archive.today/DXdrL,https://factcheck.aap.com.au/social-media-claims/no-evidence-2019-coronavirus-came-from-a-chinese-lab,False ,"There is no evidence that the 2019 Novel Coronavirus came from a Chinese laboratory. The WHO says the virus most likely originated in an animal. The number of cases of infection with the coronavirus in Wuhan has not reached 100,000 as claimed in the video."
3/6/2020,Australia,AAP FactCheck,Claim that photos show dogs being killed in China as part of efforts to combat COVID-19,Facebook user,https://www.facebook.com/TheGeneralConsensus/posts/2754640661238182?__tn__=-R,https://www.aap.com.au/these-photos-are-not-of-dogs-being-killed-because-of-coronavirus-fears/,Partially false,"Based on the evidence, AAP FactCheck found the post to be partly false. While there are media reports concerning pets being killed in China because of fears over the spread of Covid-19, they remain unverified and have been denied by authorities. The photos accompanying the Facebook post are unrelated to Covid-19. It is true that World Health Organization’s advice is there is no evidence that companion animals/pets can be infected with Covid-19 despite a single case in Hong Kong of a dog testing “weak positive”."
3/13/2020,Australia,AAP FactCheck,"Claim that notes from an ""uncle"" who ""graduated with a master's degree"" and worked at Shenzhen Hospital is advice on COVID-19 symptoms and treatment",Facebook user,http://archive.today/3WbAC,https://www.aap.com.au/uncles-notes-for-guidance-on-covid-19-coronavirus-treatment-are-misguided/,Partially false,"Based on the evidence, AAP FactCheck found the post to contain a mixture of true and false claims. A runny nose, sputum, dry cough and pneumonia can be symptoms of COVID-19 however not everyone infected with the disease will have them. Disease expert Prof Collingnon says temperatures around 26 to 27 degrees C won’t kill the virus however UV light from the sun can be effective in drying out the virus. Understanding of how long COVID-19 survives on surfaces is limited, with the WHO referring to previous studies of other viruses to estimate a range of a few hours to a few days. Drinking warm water, avoiding iced drinks and gargling warm salt water are not treatments or preventions, according to Prof Cunningham, however staying hydrated is important and gargling may relieve sore throats. The timeline for progression of COVID-19 symptoms is partly accurate but not everyone will experience all of these symptoms or in that order. Prof Cunningham also said it was not accurate to say infection will happen first in the throat, as the delicate tissues behind the nose are more likely starting points."
2/11/2020,Australia,AAP FactCheck,Claim that the 2019 novel coronavirus (COVID-19) is more deadly than Ebola or HIV,Facebook user,https://www.facebook.com/photo.php?fbid=465468534340337&set=a.134543440766183&type=3&theater,https://www.aap.com.au/the-2019-novel-coronavirus-not-more-deadly-than-ebola-or-hiv/,False ,"Based on the evidence, AAP FactCheck found the Facebook post to be false. The post’s claim that coronavirus is the most deadly disease in history is not correct. Global fatalities for HIV and Ebola are far higher, figures from the World Health Organization and the Centers for Disease Control and Prevention show."
3/11/2020,Australia,AAP FactCheck,Claim that pic of vegan food products left on otherwise bare supermarket shelf is related to COVID-19 outbreak and panic buying,Facebook user,https://www.facebook.com/stopforeignownershipinaustralia/photos/a.109745346034470/1123243601351301/?type=3&theater,https://www.aap.com.au/pic-of-untouched-vegan-food-in-supermarket-has-nothing-to-do-with-covid-19-coronavirus/,False ,"Based on the evidence, AAP FactCheck found the Facebook post to be incorrectly linking the supermarket shelf image to the 2019/20 COVID-19 coronavirus outbreak. The image of a supermarket shelf full of vegan foods while the shelves either side remain empty has nothing to do with the COVID-19 coronavirus outbreak. It was originally taken in 2017 in the United States when Hurricane Harvey hit the southern state of Texas."
3/12/2020,Australia,AAP FactCheck,Claim that disease outbreaks and pandemics correspond with election years.,Facebook user,http://archive.is/IEULB,https://www.aap.com.au/no-vote-of-confidence-for-claims-linking-pandemics-with-election-years/,False ,"Based on the evidence, AAP FactCheck found no correlation between election years and virus outbreaks. The outbreaks of SARS, Bird Flu and COVID-19 do not line up with the dates claimed in the post. In the case of Zika virus, the disease has had multiple outbreaks since 2014 in parts of Oceania and in Brazil. Bird Flu, MERS and Ebola have not been reported in Australia and have not been a significant feature of local political discussion or debate. Considering overseas elections, such as US presidential elections, there is also no consistent pattern of outbreaks occurring in election years."
3/15/2020,Australia,AAP FactCheck,Claim that football star Cristiano Ronaldo has converted his hotel chain into coronavirus hospitals,Facebook user,not available,https://www.aap.com.au/cristiano-ronaldo-is-not-converting-his-portuguese-hotels-into-covid-19-hospitals/,FALSE,Please click the link to read the full article
1/31/2020,Singapore,AFP,Singapore closed a subway stattion after a case of Cov,FB posts,https://www.facebook.com/zainul.abdulrahman/posts/1526961627480333,http://u.afp.com/singaporesubway,False ,Authorities denied
1/31/2020,Pakistan,AFP,Penjab autorities advised not to eat goat meat for 60 days,,https://www.facebook.com/photo.php?fbid=824159218059088&set=a.120839511724399&type=3&theater,http://u.afp.com/PakistanGoats,False ,"China coronavirus: Pakistani officials deny they issued warning over dangers of eating goat meat
"
1/31/2020,Canada,AFP,Chinese spies stole the virus from a Canadian lab,FB posts and articles,https://perma.cc/EF5Q-9F3S,https://factcheck.afp.com/chinese-spies-did-not-steal-deadly-coronavirus-canada,False ,Mix up with an investigation of chinese scientist in canada in 2019
1/31/2020,Algeria,AFP,This is a new wuhan hospital,,https://perma.cc/E6YD-Z6BS,https://factuel.afp.com/non-cette-image-ne-montre-pas-le-nouvel-hopital-de-wuhan-mais-le-chu-de-tanger-au-maroc,False ,This is the Tangiers hospital
1/31/2020,Brazil,AFP,fennel tean can cure Cov,FB posts,https://perma.cc/ZS6M-AQY2,https://factuel.afp.com/non-les-medecins-ne-recommandent-pas-le-au-fenouil-pour-combattre-le-nouveau-coronavirus,False ,Doctors dont say that
2/3/2020,Indonesia Algeria,AFP,This photo shows people infected lying on the sidewalk in China,Fbpots,https://perma.cc/KU35-5HLL,https://factcheck.afp.com/2014-photo-people-participating-art-project-frankfurt-germany,False ,It was a artistic performance in germany in 2014
2/4/2020,Philippines,AFP,"A photo : this is a Japanese medical professionals going to provide aid in Wuhan, ",,https://www.facebook.com/newsinjapan/photos/a.935201529847428/3085965944770965/?type=3&__tn__=H-R,http://u.afp.com/japanmedicalteam,False ,This photo has circulated in reports about a Japanese medical team travelling to China in 2008
2/4/2020,South africa,AFP,New cov comes from rhino horns,FB posts,https://perma.cc/4UX8-TWWJ,https://factcheck.afp.com/not-only-source-virus-unknown-dead-cells-inside-rhino-horn-also-are-incapable-keeping-it-alive,False ,Origin is unknown and rhino horns could not hold any virus
2/4/2020,Sri Lanka,AFP,Sri lanka eradicated Coronavirus,,https://www.facebook.com/2094208067525004/photos/a.2094214064191071/2618237678455371/?type=3&theater,http://u.afp.com/33aG,Misleading,One patient recovered but experts said its not enough to mention eradication
2/5/2020,Pakistan,AFP,Boild garlic water can protect from Cov,,https://www.youtube.com/watch?v=U5pGVNVck6E,http://u.afp.com/GarlicWater,False ,"Health experts refute false claims that drinking boiled garlic water cures novel coronavirus
"
2/5/2020,Canada,AFP,"Case of cov in Alberta, canada",FB posts,https://perma.cc/F837-DSHU,https://factcheck.afp.com/false-novel-coronavirus-warnings-circulating-alberta,False ,Authorities denied it
2/6/2020,Hong Kong,AFP,Chine Premier had dinner in Wuhan during the epidemic,,https://twitter.com/andy85742725/status/1224711148890705924,http://u.afp.com/SichuanMeal,False ,Photo taken in 2013 in sichuan
2/4/2020,Nigeria,AFP,300 000 people infected in China,FB posts,https://perma.cc/TX2J-8J5K,https://factcheck.afp.com/chinese-authorities-have-not-recorded-300000-confirmed-novel-coronavirus-cases-there-no-precise,Misleading,Fewer cases according to China
2/6/2020,Australia,AFP,The Dettol label says the cov was tested,Fb posts,https://perma.cc/D7EL-5NUE,https://factcheck.afp.com/dettols-manufacturer-denied-it-tested-its-products-novel-strain-coronavirus,False ,COv are a family of viruses
2/5/2020,Philippines,AFP,Tinospira crispa plants can treat cov,,https://www.facebook.com/alfredo.vitto.3/videos/915539555515554/,http://u.afp.com/PlantSap,Misleading,Philippine health experts dismiss misleading online claim that tinospora crispa plants can treat novel coronavirus
2/7/2020,Thailand,AFP,MOH published an infography on how to properly weaer facemasks,Multiple posts on social media,https://www.facebook.com/LivinLifeMattVlogs/videos/116142956501948/,http://u.afp.com/ThaiFaceMasks,False ,MOH denied
2/7/2020,Australia,AFP,The video shows cov patients in China,FB posts and tiktok,https://perma.cc/K28Z-HL9J,https://factcheck.afp.com/viral-video-shows-high-school-initiation-south-africa,False ,It s a school intiation in south af
2/7/2020,India,AFP,This video shows the cause of cov,FB posts,https://perma.cc/3QKJ-9TCW,https://factcheck.afp.com/video-shows-workmen-uncovering-bat-infested-roof-us-state-florida-2011,False ,the video has circulated online since at least July 2011 and actually shows repairs being made to the roof of a bat-infested house in the city of Miami in the United States.
2/10/2020,Hong Kong,AFP,Hong Kong police are misappropriating face masks for personal use,Peter Lau,https://www.facebook.com/groups/BroSisOn99/permalink/2584285341697504/,http://u.afp.com/MasksHKPolice,False ,Phtot circulating since 2018
2/10/2020,Australia,AFP,This photo shows a new case in NSW,FB posts,https://perma.cc/U25W-EHAV,https://factcheck.afp.com/photo-was-circulated-hoax-new-south-wales-health-authority-said-it-unrelated-novel-coronavirus,False ,local autorities denied it
2/11/2020,Philippines,AFP,China supreme court ok'd euthanasia of 20 000 people,PINOY KAHIT SAAN!!!,https://www.facebook.com/pinoykahitsaan/posts/10158081102060842,http://u.afp.com/CoronavirusHoax,False ,"the article was published on a site that has regularly produced hoax reports, and China has made no such announcement."
2/8/2020,Australia,AFP,The Lysol label says it s tested against the new cov,FB posts,https://perma.cc/8CSF-VLUJ,https://factcheck.afp.com/lysol-product-labels-are-not-evidence-novel-coronavirus-conspiracy,Misleading,Covs a a family of viruses
2/11/2020,Gabon,AFP,2 cov cases in libreville,FB posts,https://perma.cc/NP8X-J2PM,https://factuel.afp.com/non-il-ny-pas-eu-de-coronavirus-dans-un-hotel-libreville,False ,Authorities denied it
2/10/2020,Thailand,AFP,Green chiratta can prevent cov,,https://perma.cc/7WLU-2284,https://factcheck.afp.com/thai-health-experts-say-there-no-evidence-green-chiretta-herb-can-prevent-novel-coronavirus,,No scitific evidence for that.
2/12/2020,Philippines,AFP,Philippines has issued an order mandating a compulsory quarantine for all travellers returning from 23 countries,,https://www.facebook.com/katja.ristila.54/posts/10156681931541837,http://u.afp.com/FakeAdvisory,False ,Philippine authorities did not issue this warning after the novel coronavirus outbreak
2/12/2020,Senegal,AFP,Black people are more resistent to Cov,FB posts,https://perma.cc/F75U-HMB7,https://factuel.afp.com/non-les-personnes-noires-ne-sont-pas-plus-resistantes-au-coronavirus,False ,Dakar's Institut pasteur denies
2/13/2020,Philippines,AFP,Boiled ginger can cure cov,Katja Helena Ristilä,https://www.facebook.com/photo.php?fbid=472938080264031&set=a.112367286321114&type=3&theater,http://u.afp.com/GingerCovid19,False ,Doctors deny this
